"planning_authority","name","ons_code","plan_title","plan_id","local_development_framework_number","start_year","end_year","plan_period_found","housing_number_type","number","min","max","joint_plan_total","housing_numbers_found","is_joint_plan","source_document","cached_source_document","source_document_checksum","error_caching_source_document","notes","screenshot","created_date","updated_date","last_updated_by","published","submitted","found_sound","adopted"
"local-authority-eng:BAN","Basingstoke and Deane Borough Council","E07000084","Amended Local Plan","7ab3c965-3d06-49c9-a4b5-4985f0c4b22f","1157","2011","2029","True","HOUSING_REQUIREMENT_TOTAL","15300","","","","True","False","https://www.basingstoke.gov.uk/content/doclib/1592.pdf","https://s3.eu-west-2.amazonaws.com/local-plans/plan-documents/7ab3c965-3d06-49c9-a4b5-4985f0c4b22f.pdf","fdc0cf3c39e291e7b177d1b4d3d1da98","HTTPSConnectionPool(host='www.basingstoke.gov.uk', port=443): Max retries exceeded with url: /content/doclib/1592.pdf (Caused by SSLError(SSLCertVerificationError(1, '[SSL: CERTIFICATE_VERIFY_FAILED] certificate verify failed: unable to get local issuer certificate (_ssl.c:997)')))","","https://s3.eu-west-2.amazonaws.com/local-plans/images/31a188f8-e637-400d-bcb5-6865df4e0bfc.jpg","2019-04-30 14:12:38.839133","2025-03-21 01:32:40.020306","","2014-04-25","2014-10-09","2016-04-06","2016-05-26"
"local-authority-eng:BAN","Basingstoke and Deane Borough Council","E07000084","Basingstoke & Deane Local Plan 2021-2040","021ef75b-da94-433d-a3cf-f9a7c1a8a3bb","2326","2021","2040","True","HOUSING_REQUIREMENT_TOTAL","16180","","","","True","False","https://www.basingstoke.gov.uk/content/doclib/4126.pdf","","","HTTPSConnectionPool(host='www.basingstoke.gov.uk', port=443): Max retries exceeded with url: /content/doclib/4126.pdf (Caused by SSLError(SSLCertVerificationError(1, '[SSL: CERTIFICATE_VERIFY_FAILED] certificate verify failed: unable to get local issuer certificate (_ssl.c:997)')))","Annual average is 852 DPA.  Taken from Reg 18 consultation document (Jan 2024)","","2024-05-13 12:20:52.046652","2025-03-21 01:26:22.077137","","","","",""
"local-authority-eng:BDF","Bedford Borough Council","E06000055","Bedford Borough Local Plan 2030","3c3c274f-d3e5-4517-a075-8868aaa8af42","1897","2015","2030","True","HOUSING_REQUIREMENT_TOTAL","14550","","","","True","False","https://bbcdevwebfiles.blob.core.windows.net/webfiles/Planning%20and%20Building/local-plan-2030/Local%20Plan%202030%20ADOPTED%20VERSION.pdf","https://s3.eu-west-2.amazonaws.com/local-plans/plan-documents/3c3c274f-d3e5-4517-a075-8868aaa8af42.pdf","8d7abab65d673f5a7b0b9ddb7ef51cce","","Bedford are committed to an early review of Local Plan 2030 - no later than one year after adoption - Ch1, para 1.6 (see new policy in MM1)","https://s3.eu-west-2.amazonaws.com/local-plans/images/3c3c274f-d3e5-4517-a075-8868aaa8af42/5c20a730-473d-495a-9e28-f0bf537aa7d8.jpg","2019-04-30 14:12:38.351047","2025-03-21 01:29:01.591140","","2018-09-18","2018-12-14","2019-12-20","2020-01-15"
"local-authority-eng:BDF","Bedford Borough Council","E06000055","Local Plan 2040","c6b88c87-4029-4871-aabb-18ecf4baecf3","2183","2020","2040","True","HOUSING_REQUIREMENT_TOTAL","27100","","","","True","False","https://edrms.bedford.gov.uk/OpenDocument.aspx?id=xivh8bP%2bAJZXEaq26SnEFQ%3d%3d&name=PLAN%20FOR%20SUBMISSION.pdf","https://s3.eu-west-2.amazonaws.com/local-plans/plan-documents/c6b88c87-4029-4871-aabb-18ecf4baecf3.pdf","a701f9c3dfc9327e4ae916ca809c3e51","503 Server Error: Service Unavailable for url: https://edrms.bedford.gov.uk/OpenDocument.aspx?id=xivh8bP%2BAJZXEaq26SnEFQ%3D%3D&name=PLAN%20FOR%20SUBMISSION.pdf","Housing Requirement subject to change. Taken from Reg 19 version of Plan published 15 June 2022. ","https://s3.eu-west-2.amazonaws.com/local-plans/images/c6b88c87-4029-4871-aabb-18ecf4baecf3/e11b01ef-5792-4c54-b8f4-6b4d8910b294.jpg","2022-04-07 10:49:33.470280","2025-03-21 01:28:50.463241","","2022-06-15","2023-01-12","",""
"local-authority-eng:BPL","Blackpool Borough Council","E06000009","Core Strategy","62a44b10-cdc6-4f7f-ba96-c60decf184ff","1168","2012","2027","True","HOUSING_REQUIREMENT_TOTAL","4200","","","","True","False","https://www.blackpool.gov.uk/Residents/Planning-environment-and-community/Documents/J118003-107575-2016-updated-17-Feb-2016-High-Res.pdf","https://s3.eu-west-2.amazonaws.com/local-plans/plan-documents/62a44b10-cdc6-4f7f-ba96-c60decf184ff.pdf","56828b0592d6ce7be369a177a6a61df6","504 Server Error: Gateway Time-out for url: https://www.blackpool.gov.uk/Residents/Planning-environment-and-community/Documents/J118003-107575-2016-updated-17-Feb-2016-High-Res.pdf","Housing trajectory is :
2012-2017: 250 DPA; 2017-2022: 280 DPA; 2022-2027: 310 DPA.
","https://s3.eu-west-2.amazonaws.com/local-plans/images/62a44b10-cdc6-4f7f-ba96-c60decf184ff/aade8288-f044-4ecd-b52d-10069580b72e.jpg","2019-04-30 14:12:38.410571","2025-03-21 01:08:29.031651","","2014-07-04","2014-12-18","2015-11-23","2016-01-20"
"local-authority-eng:BPL","Blackpool Borough Council","E06000009","New Local Plan to 2042","74750ad2-e20a-4179-a7b2-dc8ad51dcb8b","2301","2023","2042","True","","","","","","False","False","","","","","","","2023-08-17 14:24:31.749935","2023-08-17 14:25:04.319634","robert.putnam","","","",""
"local-authority-eng:COP","Copeland Borough Council","E07000029","Copeland Local Plan 2021-2039","8ee21257-ede9-489f-9f60-73911898dc92","2008","2021","2039","True","HOUSING_REQUIREMENT_TOTAL","2628","","","","True","False","https://www.copeland.gov.uk/sites/default/files/attachments/localplanpublicationdraft.pdf","","","An error occurred (InvalidAccessKeyId) when calling the PutObject operation: The AWS Access Key Id you provided does not exist in our records.","IR71.	Paragraph 22 of the Framework requires strategic policies to look ahead over a minimum period of 15 years from adoption.  Consequently, the requirement in Policy H2 is updated by adding an additional year to reflect a 15-year period.  The housing requirement is, therefore, updated to 2,628 dwellings to reflect this additional year (146 DPA).  ","https://s3.eu-west-2.amazonaws.com/local-plans/images/8ee21257-ede9-489f-9f60-73911898dc92/8c4d233c-f37f-4eaa-95e4-bb109d0a21b8.jpg","2020-10-30 16:33:20.557578","2025-03-21 01:26:18.869526","","2022-01-10","2022-09-16","2024-09-23","2024-11-05"
"local-authority-eng:CHC","Christchurch Borough Council","E07000048","Christchurch and East Dorset Local Plan Part 1 - Core Strategy","8b48f728-8835-4b44-8f1a-d41101baeda1","398","2013","2028","True","HOUSING_REQUIREMENT_TOTAL","","","","8490","True","True","https://www.dorsetforyou.gov.uk/planning-buildings-land/planning-policy/christchurch/local-development-framework/local-plan-part-1/pdfs/local-plan-part-1/christchurch-and-east-dorset-adopted-core-strategy.pdf","https://s3.eu-west-2.amazonaws.com/local-plans/plan-documents/8b48f728-8835-4b44-8f1a-d41101baeda1.pdf","b8a787890fa8be74c4bfcbfe7503f19a","HTTPSConnectionPool(host='www.dorsetforyou.gov.uk', port=443): Max retries exceeded with url: /planning-buildings-land/planning-policy/christchurch/local-development-framework/local-plan-part-1/pdfs/local-plan-part-1/christchurch-and-east-dorset-adopted-core-strategy.pdf (Caused by NewConnectionError('<urllib3.connection.HTTPSConnection object at 0x7f8f4b46c100>: Failed to establish a new connection: [Errno -5] No address associated with hostname'))","","https://s3.eu-west-2.amazonaws.com/local-plans/images/8ffc1244-d35f-46e5-870b-33d86c245a5f.jpg","2019-04-30 14:12:39.238384","2025-03-21 01:30:20.531316","","2012-04-02","2013-03-15","2014-03-21","2014-04-28"
"local-authority-eng:BRM","Bromsgrove District Council","E07000234","Bromsgrove District Plan","602147fb-c091-4eee-b8a4-c19f09ca1509","1503","2011","2030","True","HOUSING_REQUIREMENT_TOTAL","10400","","","","True","False","https://www.bromsgrove.gov.uk/media/2673698/Adopted-BDP-January-2017.pdf","https://s3.eu-west-2.amazonaws.com/local-plans/plan-documents/602147fb-c091-4eee-b8a4-c19f09ca1509.pdf","b28b1e89578ec13529923fda62b56510","Document at https://www.bromsgrove.gov.uk/media/2673698/Adopted-BDP-January-2017.pdf might not be a pdf","Includes unmet need of 3,400 from Redditch.  

HDT colleagues tell us that the 3400 housing requirement from Redditch NOT transferred to Bromsgrove, the requirement sits with Redditch. ","https://s3.eu-west-2.amazonaws.com/local-plans/images/602147fb-c091-4eee-b8a4-c19f09ca1509/2a5145ef-11fe-48f0-a672-aebfa6263c82.jpg","2019-04-30 14:12:38.547999","2025-03-21 01:29:40.379555","","2013-09-30","2014-03-12","2016-12-16","2017-01-25"
"local-authority-eng:BRM","Bromsgrove District Council","E07000234","Bromsgrove District Plan Review","f3ca442b-5c64-47f8-a728-d9208714fbde","2107","2023","2040","True","HOUSING_REQUIREMENT_YEARLY_AVERAGE","379","","","","True","False","https://www.bromsgrove.gov.uk/media/2bzgyp1w/bdp-review-update-consultation-24-09-19.pdf","","","An error occurred (InvalidAccessKeyId) when calling the PutObject operation: The AWS Access Key Id you provided does not exist in our records.","5.2 As required by the standardised methodology for local housing need in the NPPF, the reviewed
BDP will need to provide for a minimum of 379 new dwellings per annum, equalling 6443 new
dwellings up to 2040.  (Sept. 2019 consultation)","https://s3.eu-west-2.amazonaws.com/local-plans/images/f3ca442b-5c64-47f8-a728-d9208714fbde/3952e907-ac08-4ed6-adee-ced918200bef.jpg","2020-09-22 13:13:34.199063","2025-03-21 01:29:32.506934","","","","",""
"local-authority-eng:BNE","London Borough of Barnet","E09000003","Barnet's Local Plan (Core Strategy)","48647056-2c80-4d6f-a403-ace690639a61","1193","2011","2026","True","HOUSING_REQUIREMENT_TOTAL","28000","","","","True","False","https://www.barnet.gov.uk/sites/default/files/assets/citizenportal/documents/planningconservationandbuildingcontrol/PlanningPolicy/LocalPlan/DPD/LocalPlanCoreStrategyDPDSeptember2012.pdf","https://s3.eu-west-2.amazonaws.com/local-plans/plan-documents/48647056-2c80-4d6f-a403-ace690639a61.pdf","5fda482c3ab17c24b29ec46f9419378e","","Stepped requirement: 2011-2022: 2200 DPA; 2022-2026: 1500 DPA.","https://s3.eu-west-2.amazonaws.com/local-plans/images/48647056-2c80-4d6f-a403-ace690639a61/9d2a3108-c898-471d-b321-c4306e320238.jpg","2019-04-30 14:12:39.810155","2025-03-21 01:18:23.129110","","2010-09-30","2011-08-16","2012-06-22","2012-09-11"
"local-authority-eng:BNE","London Borough of Barnet","E09000003","Local Plan for Barnet","6fabb14e-98ce-4597-b679-af48f4dd1919","1970","2021","2036","True","HOUSING_REQUIREMENT_TOTAL","35460","","","","True","False","https://www.barnet.gov.uk/sites/default/files/local_plan_reg_19.pdf","","","404 Client Error: Not Found for url: https://www.barnet.gov.uk/sites/default/files/local_plan_reg_19.pdf","Housing had been 46,000 (total for 2021-2036) from Jan 2020 Reg 18 'Preferred Approach' document. In June 2021 Publication Reg 19 document it is now 35,460 for same period.","https://s3.eu-west-2.amazonaws.com/local-plans/images/6fabb14e-98ce-4597-b679-af48f4dd1919/598bc67c-15b7-4d13-ba3b-a66abc979b01.jpg","2021-09-15 10:20:44.601536","2025-03-21 01:29:50.391297","","2021-06-28","2021-11-26","2024-11-06",""
"local-authority-eng:DAR","Dartford Borough Council","E07000107","Dartford New Local Plan","24f1e624-6b8a-4914-9dc9-6fb5f3c28dd9","2236","2021","2037","True","HOUSING_REQUIREMENT_YEARLY_AVERAGE","790","","","","True","False","https://www.dartford.gov.uk/downloads/file/2248/the-dartford-plan","","","An error occurred (InvalidAccessKeyId) when calling the PutObject operation: The AWS Access Key Id you provided does not exist in our records.","See policy S4 (page 52 of adopted plan) 
Housing Requirement : New homes are required to be delivered at an average rate of 790 per annum 
(totalling 12,640 homes from April 2021 to March 2037 inclusive).","https://s3.eu-west-2.amazonaws.com/local-plans/images/24f1e624-6b8a-4914-9dc9-6fb5f3c28dd9/7ee6bd29-3862-4351-90cb-e8c90a5e1ba1.jpg","2021-12-06 11:35:05.125416","2025-03-21 01:29:08.976829","","2021-09-15","2021-12-13","2024-02-05","2024-04-22"
"local-authority-eng:CMD","London Borough of Camden","E09000007","Camden Local Plan 2017","a1cfa4ac-822b-4727-a5fd-0c55909a15bb","1746","2016","2031","True","HOUSING_REQUIREMENT_TOTAL","16800","","","","True","False","https://www.camden.gov.uk/documents/20142/4820180/Local+Plan.pdf/ce6e992a-91f9-3a60-720c-70290fab78a6","https://s3.eu-west-2.amazonaws.com/local-plans/plan-documents/a1cfa4ac-822b-4727-a5fd-0c55909a15bb.pdf","1d46e008a832aafe87a1aecd8c1fd47a","403 Client Error: Forbidden for url: https://www.camden.gov.uk/documents/20142/4820180/Local+Plan.pdf/ce6e992a-91f9-3a60-720c-70290fab78a6","1,120 new homes per annum.","https://s3.eu-west-2.amazonaws.com/local-plans/images/a1cfa4ac-822b-4727-a5fd-0c55909a15bb/3cc9330d-2e7d-4752-a3a8-bdf82d6a01c1.jpg","2019-04-30 14:12:38.941136","2025-03-21 01:29:53.600244","","2016-02-08","2016-06-24","2017-05-10","2017-07-03"
"local-authority-eng:CMD","London Borough of Camden","E09000007","Local Plan Review","900e29c6-b39e-40a5-a740-08a85b4ed895","2304","2026","2041","True","HOUSING_REQUIREMENT_YEARLY_AVERAGE","770","","","","True","False","https://www.camden.gov.uk/documents/20142/4820180/Draft+New+Camden+Local+Plan+2024+v1.pdf/415cc7da-c24a-8237-ddc2-5c72045af9d2?t=1706548115256","","","403 Client Error: Forbidden for url: https://www.camden.gov.uk/documents/20142/4820180/Draft+New+Camden+Local+Plan+2024+v1.pdf/415cc7da-c24a-8237-ddc2-5c72045af9d2?t=1706548115256","See Page 162
Policy H1 – Maximising Housing Supply
The Council will aim to deliver 11,550 additional homes over the Plan period to 2041. ","","2023-08-17 14:29:14.152038","2025-03-21 01:10:59.363865","","","","",""
"local-authority-eng:AMB","Amber Valley Borough Council","E07000032","Amber Valley Borough Local Plan (2022-2040)","808d8dbd-1b1d-45fa-a4ca-adbc2a4fdfbd","2191","2022","2040","True","HOUSING_REQUIREMENT_TOTAL","7632","","","","True","False","https://info.ambervalley.gov.uk/docarc/docviewer.aspx?docguid=4f90603569e841be827ba722c54b7cd2","","","An error occurred (InvalidAccessKeyId) when calling the PutObject operation: The AWS Access Key Id you provided does not exist in our records.","Post-hearing advice from Inspectors: ""For reasons to be set out in our final report, we are satisfied with the Council’s approach to provide 1,320 homes within the Plan towards meeting Derby’s unmet need, with further provision to be made through a new Plan under Policy MR1. However, this figure should be reflected within the housing requirement. When added to the Local Housing Need figure of 351 dwellings per annum (dpa) the annual requirement for the Borough will be 424 dpa with a Plan requirement of 7,632 dwellings.""  Advice additionally recommends that the Council redraft Policy MR1 committing to undertake preparation of a new Plan on adoption.","https://s3.eu-west-2.amazonaws.com/local-plans/images/808d8dbd-1b1d-45fa-a4ca-adbc2a4fdfbd/b25f921e-3867-44c1-aad5-254961247de5.jpg","2022-07-07 11:50:15.603635","2025-03-21 01:18:08.342687","","2024-02-16","2024-07-29","",""
"local-authority-eng:CON","Cornwall Council","E06000052","Cornwall Local Plan: Strategic Policies 2010-2030","ff7a8a59-3da4-4d24-a2ec-0a1b75d108bb","1435","2010","2030","True","HOUSING_REQUIREMENT_TOTAL","52500","","","","True","False","https://www.cornwall.gov.uk/media/22936789/adopted-local-plan-strategic-policies-2016.pdf","https://s3.eu-west-2.amazonaws.com/local-plans/plan-documents/ff7a8a59-3da4-4d24-a2ec-0a1b75d108bb.pdf","2372793f32f9b8432be4f7bc9321d027","404 Client Error: Not Found for url: https://www.cornwall.gov.uk/media/22936789/adopted-local-plan-strategic-policies-2016.pdf","","https://s3.eu-west-2.amazonaws.com/local-plans/images/e2a206b1-941a-4ace-9c76-a819dba321fa.jpg","2019-04-30 14:12:38.589315","2025-03-21 01:21:14.149206","","2014-03-17","2015-02-05","2016-09-23","2016-11-22"
"local-authority-eng:CAT","Canterbury City Council","E07000106","Canterbury District Local Plan","3fd7dd48-a240-42ed-b9ed-411731039393","1468","2011","2031","True","HOUSING_REQUIREMENT_TOTAL","16000","","","","True","False","https://www.canterbury.gov.uk/download/downloads/id/868/canterbury_district_local_plan_adopted_july_2017.pdf","https://s3.eu-west-2.amazonaws.com/local-plans/plan-documents/3fd7dd48-a240-42ed-b9ed-411731039393.pdf","ad08405dbde4d661769932315db1f5c2","404 Client Error: Not Found for url: https://www.canterbury.gov.uk/download/downloads/id/868/canterbury_district_local_plan_adopted_july_2017.pdf","","https://s3.eu-west-2.amazonaws.com/local-plans/images/3fd7dd48-a240-42ed-b9ed-411731039393/1c3b3b84-df00-4e5d-9727-b8d5e14ac41e.jpg","2019-04-30 14:12:38.958180","2025-03-21 01:26:10.098608","","2014-06-05","2014-11-21","2017-06-15","2017-07-13"
"local-authority-eng:CAT","Canterbury City Council","E07000106","New Canterbury District Local Plan (2020-2040)","95c22f97-067a-4e85-b92e-fa0ae36bf8bc","2109","2020","2041","True","HOUSING_REQUIREMENT_YEARLY_AVERAGE","1149","","","","True","False","https://drive.google.com/file/d/1A4mbz5MbkbAU6l3RIZPaFpY7LOPbonHc/view","","","404 Client Error: Not Found for url: https://drive.google.com/file/d/1A4mbz5MbkbAU6l3RIZPaFpY7LOPbonHc/view","Policy SS3 - Development Strategy for the district 
1. Between 2020/21 and 2040/41 provision
is made through the granting of
planning permission and the allocation
of sites for:
(a) an average of 1,149 new dwellings
per year including affordable
housing, older persons housing and
a range of sizes and types of housing
to meet local needs.","","2020-09-22 13:04:52.865673","2025-03-21 01:26:16.685847","","","","",""
"local-authority-eng:CLD","Calderdale Metropolitan Borough Council","E08000033","Calderdale Local Plan","74564582-cddd-45f4-b09c-35e08902cf91","2006","2018","2033","True","HOUSING_REQUIREMENT_TOTAL","14950","","","","True","False","http://calderdale-consult.limehouse.co.uk/portal/planning_services/lpp18/lpp18?pointId=4796887","","","Document at http://calderdale-consult.limehouse.co.uk/portal/planning_services/lpp18/lpp18?pointId=4796887 might not be a pdf","Text taken from Table 6.1 of the adopted plan:  ""Housing Requirement 2018/19 – 2032/33""
Total Housing Requirement 2018/19 – 2032/33: 14,950
Average Annual Housing Requirement: 997 (rounded)
","https://s3.eu-west-2.amazonaws.com/local-plans/images/74564582-cddd-45f4-b09c-35e08902cf91/9ed7e7b3-50b6-4ca1-af13-98b394dced23.jpg","2019-04-30 14:12:39.122791","2025-03-21 01:26:06.861316","","2018-08-10","2019-01-11","2023-01-26","2023-03-22"
"local-authority-eng:ALL","Allerdale Borough Council","E07000026","Allerdale Local Plan (Part 1)","5538be07-3fac-4f4c-89d4-376868e6fdc1","1320","2011","2029","True","HOUSING_REQUIREMENT_YEARLY_AVERAGE","304","","","","True","False","https://www-cloudfront.allerdale.gov.uk/media/filer_public/75/ab/75ab8862-bdee-4f3d-850d-2735286da5c1/adopted_allerdale_local_plan_part_1_-_final_version_151014.pdf","https://s3.eu-west-2.amazonaws.com/local-plans/plan-documents/5538be07-3fac-4f4c-89d4-376868e6fdc1.pdf","00641f6020edd60a1f1d3054f40c8d87","","","https://s3.eu-west-2.amazonaws.com/local-plans/images/5538be07-3fac-4f4c-89d4-376868e6fdc1/91c9e22b-82bb-4aed-a706-ea478cfd4a5e.jpg","2019-04-30 14:12:38.596910","2025-03-21 01:32:42.252775","","2013-05-03","2013-10-23","2014-07-01","2014-07-16"
"local-authority-eng:CRY","London Borough of Croydon","E09000008","Strategic Policies Partial Review","91ac26b7-d253-4569-9a70-92763649a92a","1784","2016","2036","True","HOUSING_REQUIREMENT_TOTAL","32890","","","","True","False","https://www.croydon.gov.uk/sites/default/files/articles/downloads/Croydon%20Local%20Plan%202018_0.pdf","https://s3.eu-west-2.amazonaws.com/local-plans/plan-documents/91ac26b7-d253-4569-9a70-92763649a92a.pdf","8e3b975b6fd28f297ce6176a6454328d","404 Client Error: Not Found for url: https://www.croydon.gov.uk/sites/default/files/articles/downloads/Croydon%20Local%20Plan%202018_0.pdf","","https://s3.eu-west-2.amazonaws.com/local-plans/images/91ac26b7-d253-4569-9a70-92763649a92a/c70efc90-bda8-4fc8-a489-36c47e75fa87.jpg","2019-04-30 14:12:40.769040","2025-03-21 01:29:22.980578","","2016-09-05","2017-02-02","2018-01-16","2018-02-27"
"local-authority-eng:CRY","London Borough of Croydon","E09000008","Croydon Local Plan Review","7232ef7b-549a-49a6-b6a4-c3839c719b6b","2144","2019","2040","True","HOUSING_REQUIREMENT_TOTAL","34145","","","","True","False","https://www.croydon.gov.uk/sites/default/files/2022-01/proposed-submission-of-croydon-local-plan-2019-to-2039-tracked-changes.pdf","","","An error occurred (InvalidAccessKeyId) when calling the PutObject operation: The AWS Access Key Id you provided does not exist in our records.","July 2024 Reg 19 consultation updates housing requirement of 37,736 dwellings in previous Jan 2022 Reg 19 plan.  New Policy SP1.0A sets a minimum of 34,145 new homes to be delivered (2019-2040).","","2024-08-20 11:14:22.802379","2025-03-21 01:29:27.334387","","2024-07-01","2024-11-29","",""
"local-authority-eng:BRO","Broadland District Council","E07000144","Greater Norwich Local Plan","b428be92-9a52-48d4-9bd5-6c99a3f63c79","2254","2018","2038","True","HOUSING_REQUIREMENT_TOTAL","","","","40541","True","True","https://www.gnlp.org.uk/sites/gnlp/files/2024-03/Strategy%20-%20draft%20final%202.pdf","","","An error occurred (InvalidAccessKeyId) when calling the PutObject operation: The AWS Access Key Id you provided does not exist in our records.","Inspectors consider that the housing requirement of 40,541 homes for the Plan period is justified and consistent with national policy.  Source document given above is adopted plan.","https://s3.eu-west-2.amazonaws.com/local-plans/images/b428be92-9a52-48d4-9bd5-6c99a3f63c79/81e2349e-6706-4c7b-85a9-22767830ce21.jpg","2019-07-23 12:51:34.007150","2025-03-21 01:26:08.642319","","2021-02-01","2021-07-30","2024-02-19","2024-03-28"
"local-authority-eng:CHN","Chiltern District Council","E07000005","Core Strategy for Chiltern District","8f4eecb8-0d98-4af4-b5b5-0ffc9451a190","959","2006","2026","True","HOUSING_REQUIREMENT_RANGE","","2650","2900","","True","False","https://chiltern.gov.uk/media/1199/Adopted-Core-Strategy-for-Chiltern-District/pdf/Core_Startegy_Final_Web_Version_2012.pdf?m=634757182387600000","https://s3.eu-west-2.amazonaws.com/local-plans/plan-documents/8f4eecb8-0d98-4af4-b5b5-0ffc9451a190.pdf","c0397c1ba973d0723e2ce9925333befd","Document at https://chiltern.gov.uk/media/1199/Adopted-Core-Strategy-for-Chiltern-District/pdf/Core_Startegy_Final_Web_Version_2012.pdf?m=634757182387600000 might not be a pdf","","https://s3.eu-west-2.amazonaws.com/local-plans/images/8f4eecb8-0d98-4af4-b5b5-0ffc9451a190/4b17a74e-8bf4-4c68-87d4-05367407032f.jpg","2019-04-30 14:12:40.963838","2025-03-21 01:32:48.454528","","2010-10-14","2011-01-13","2011-10-06","2011-11-15"
"local-authority-eng:CHN","Chiltern District Council","E07000005","Chiltern and South Bucks Local Plan - Withdrawn 21 October 2020","e44f3ac6-d9bd-4f26-a318-3f187eea80d3","1940","2016","2036","True","HOUSING_REQUIREMENT_TOTAL","","","","11099","True","True","https://www.southbucks.gov.uk/media/13288/Draft-Chiltern-and-South-Bucks-Local-Plan-2036/pdf/draft_Chiltern_and_South_Bucks_Local_Plan_2036_Final.pdf?m=636954976691670000","https://s3.eu-west-2.amazonaws.com/local-plans/plan-documents/e44f3ac6-d9bd-4f26-a318-3f187eea80d3.pdf","820565794c26e7ee2009f2aa5d705577","Document at https://www.southbucks.gov.uk/media/13288/Draft-Chiltern-and-South-Bucks-Local-Plan-2036/pdf/draft_Chiltern_and_South_Bucks_Local_Plan_2036_Final.pdf?m=636954976691670000 might not be a pdf","Excludes 4,161 unmet need to be met through Aylesbury Vale Local Plan.","https://s3.eu-west-2.amazonaws.com/local-plans/images/e44f3ac6-d9bd-4f26-a318-3f187eea80d3/2cecb3c5-08a1-4441-8336-3a957fbd9c6d.jpg","2019-04-30 14:12:40.540499","2025-03-21 01:26:05.532651","","2019-06-07","2019-09-26","",""
"local-authority-eng:BDG","London Borough of Barking and Dagenham","E09000002","The Barking and Dagenham Local Plan 2037","3bda3313-7fc4-41e1-ae6f-b29af6accb3c","1978","2020","2037","True","HOUSING_REQUIREMENT_TOTAL","38864","","","","True","False","https://local-plans-prototype.herokuapp.com/local-plans/local-authority-eng:BDG","","","Document at https://local-plans-prototype.herokuapp.com/local-plans/local-authority-eng:BDG might not be a pdf","Stepped Requirements: 
2020/21-2028/29 (with first 5year post adoption period starting 23/24): London Plan based target: 1,944; New requirement: 2,121.    2029/30-2033/34: London Plan based target: 2,699; New target: 2,876.  2034/35-2036/37: London Plan based target: 1,908; New requirement: 2,085.
","https://s3.eu-west-2.amazonaws.com/local-plans/images/3bda3313-7fc4-41e1-ae6f-b29af6accb3c/74b14388-ba0f-4f94-93ad-e3072cdee985.jpg","2019-04-30 14:12:39.792801","2025-03-21 01:29:58.035351","","2020-10-05","2021-12-20","2024-08-15","2024-09-18"
"local-authority-eng:COL","Colchester Borough Council","E07000071","Colchester Local Plan (North Essex Garden Communities)","63778fb0-7e0d-4c36-b9a1-bac42546f982","1841","2013","2033","True","HOUSING_REQUIREMENT_TOTAL","18400","","","","True","False","https://cbccrmdata.blob.core.windows.net/noteattachment/CBC-Local-Plan-North-Essex-Authorities-Shared-Strategic-Section-1-Post%20Committee%20Colchester%2028th%20Jan%2021.pdf","https://s3.eu-west-2.amazonaws.com/local-plans/plan-documents/63778fb0-7e0d-4c36-b9a1-bac42546f982.pdf","75a24b1d2396acb96e32ad068a58cdbc","","Aligned Local Plan with North Essex authorities (Braintree, Colchester, Tendring).","https://s3.eu-west-2.amazonaws.com/local-plans/images/63778fb0-7e0d-4c36-b9a1-bac42546f982/d61fc83d-29bd-4cce-991d-98372226a203.jpg","2019-04-30 14:12:40.534068","2025-03-21 01:18:43.378292","","2017-06-16","2017-10-09","2020-12-10","2021-02-01"
