"planning_authority","name","ons_code","plan_title","plan_id","local_development_framework_number","start_year","end_year","plan_period_found","housing_number_type","number","min","max","joint_plan_total","housing_numbers_found","is_joint_plan","source_document","cached_source_document","source_document_checksum","error_caching_source_document","notes","screenshot","created_date","updated_date","last_updated_by","published","submitted","found_sound","adopted"
"local-authority-eng:EPS","Epsom and Ewell Borough Council","E07000208","Core Strategy 2007","d06d0c20-25a1-4c64-a419-37ee6df26663","374","2007","2022","True","HOUSING_REQUIREMENT_TOTAL","2715","","","","True","False","https://www.epsom-ewell.gov.uk/sites/default/files/documents/residents/planning/planning-policy/Core%20Strategy%202007.pdf","https://s3.eu-west-2.amazonaws.com/local-plans/plan-documents/d06d0c20-25a1-4c64-a419-37ee6df26663.pdf","bafc544aa54dc1c0166737b16b402061","HTTPSConnectionPool(host='www.epsom-ewell.gov.uk', port=443): Max retries exceeded with url: /sites/default/files/documents/residents/planning/planning-policy/Core%20Strategy%202007.pdf (Caused by NewConnectionError('<urllib3.connection.VerifiedHTTPSConnection object at 0x7f772c69aa90>: Failed to establish a new connection: [Errno -3] Temporary failure in name resolution'))","","https://s3.eu-west-2.amazonaws.com/local-plans/images/d06d0c20-25a1-4c64-a419-37ee6df26663/05564a63-a8fc-47fa-9c2f-d164e4ea0be4.jpg","2019-04-30 14:12:39.362772","2025-03-21 01:26:23.090102","","2006-06-01","2006-07-05","2007-05-16","2007-07-24"
"local-authority-eng:EPS","Epsom and Ewell Borough Council","E07000208","Local Plan 2040","d247b33d-7bcf-44fd-a292-c317e8390cdb","2148","2022","2040","True","HOUSING_REQUIREMENT_TOTAL","4700","","","","True","False","https://www.epsom-ewell.gov.uk/sites/default/files/documents/residents/planning/planning-policy/epsom-and-ewell-local-plan/EEBC%20-%20Regulation%2019%20-%20Proposed%20Submission%20Local%20Plan.pdf","","","An error occurred (InvalidAccessKeyId) when calling the PutObject operation: The AWS Access Key Id you provided does not exist in our records.","The Local Plan housing requirement has been set as a 
minimum of 4,700 dwellings over the plan period (2022-2040). (Reg 19 plan, December 2024)","","2022-07-29 12:26:16.243778","2025-03-21 01:26:04.938855","","2024-12-20","","",""
"local-authority-eng:EST","East Staffordshire Borough Council","E07000193","Local Plan","a8cffe27-82e3-494d-ad90-550379c07894","1085","2012","2031","True","HOUSING_REQUIREMENT_TOTAL","11648","","","","True","False","http://www.eaststaffsbc.gov.uk/sites/default/files/docs/planning/planningpolicy/localplan2012-2031/Local-Plan-2012-2031-FINAL.pdf","https://s3.eu-west-2.amazonaws.com/local-plans/plan-documents/a8cffe27-82e3-494d-ad90-550379c07894.pdf","7abafa4346be6d431bb5ac3159cdc37e","HTTPConnectionPool(host='www.eaststaffsbc.gov.uk', port=80): Max retries exceeded with url: /sites/default/files/docs/planning/planningpolicy/localplan2012-2031/Local-Plan-2012-2031-FINAL.pdf (Caused by ConnectTimeoutError(<urllib3.connection.HTTPConnection object at 0x7f8f4b725570>, 'Connection to www.eaststaffsbc.gov.uk timed out. (connect timeout=None)'))","","https://s3.eu-west-2.amazonaws.com/local-plans/images/5c6cbe3c-0500-4566-8603-d50dfde510cd.jpg","2019-04-30 14:12:39.286204","2025-03-21 01:17:53.205593","","2013-10-18","2014-04-11","2015-10-07","2015-10-15"
"local-authority-eng:HER","Hertsmere Borough Council","E07000098","Local Plan Core Strategy DPD","e2c62572-f35d-4efb-9d5b-f7c61cff9383","1220","2012","2027","True","HOUSING_REQUIREMENT_TOTAL","3990","","","","True","False","https://www.hertsmere.gov.uk/Documents/09-Planning--Building-Control/Planning-Policy/Local-Development-Framework/Core-Strategy-DPD-2013.pdf","https://s3.eu-west-2.amazonaws.com/local-plans/plan-documents/e2c62572-f35d-4efb-9d5b-f7c61cff9383.pdf","9eb465a2ebd108dff45bac2e8bcbf0c0","An error occurred (InvalidAccessKeyId) when calling the PutObject operation: The AWS Access Key Id you provided does not exist in our records.","","https://s3.eu-west-2.amazonaws.com/local-plans/images/e2c62572-f35d-4efb-9d5b-f7c61cff9383/204db985-e038-4083-aded-df9f785f7cf9.jpg","2019-04-30 14:12:39.766893","2025-03-21 01:28:35.117850","","2011-11-28","2012-02-10","2012-12-05","2013-01-16"
"local-authority-eng:HER","Hertsmere Borough Council","E07000098","Hertsmere Local Plan 2024","b2db24ec-1621-4d5f-97e3-faa694050f88","2325","2025","2041","True","HOUSING_REQUIREMENT_YEARLY_AVERAGE","590","","","","True","False","https://www.hertsmere.gov.uk/Documents/09-Planning--Building-Control/Planning-Policy/Local-Plan/Hertsmere-Local-Plan-Regulation-18-Consultation-Document-2024-compressed-pdf-9.56-Mb.pdf","","","An error occurred (InvalidAccessKeyId) when calling the PutObject operation: The AWS Access Key Id you provided does not exist in our records.","Reg 18 (Apr-24) provides 590 DPA or 9,400 homes in the 16-year period from the submission of the Local Plan in 2025 through to 2041 (15-year period from the anticipate date of adoption).  The previous iteration of the local plan Reg 18 (Sep-21) provided 760 DPA.","","2024-05-10 21:48:19.639802","2025-03-21 01:05:04.313677","","","","",""
"local-authority-eng:HER","Hertsmere Borough Council","E07000098","South West Hertfordshire 2050","ef11b630-d6d9-4e36-9268-ab343bee7b33","2285","2025","2050","True","","","","","","False","True","","","","","","","2022-09-05 13:39:24.987966","2022-09-05 13:39:58.563379","robert.putnam","","","",""
"local-authority-eng:HAE","Hambleton District Council","E07000164","Hambleton Local Plan","b3a6f957-a015-4ac6-8e92-c0aab6b423b2","1991","2014","2036","True","HOUSING_REQUIREMENT_TOTAL","6930","","","","True","False","https://www.hambleton.gov.uk/downloads/file/2745/hambleton-local-plan-final-february-2022","https://s3.eu-west-2.amazonaws.com/local-plans/plan-documents/b3a6f957-a015-4ac6-8e92-c0aab6b423b2.pdf","a4e42aa839539584abd2621f7ae7400c","HTTPSConnectionPool(host='www.hambleton.gov.uk', port=443): Max retries exceeded with url: /downloads/file/2745/hambleton-local-plan-final-february-2022 (Caused by SSLError(SSLCertVerificationError(1, '[SSL: CERTIFICATE_VERIFY_FAILED] certificate verify failed: certificate has expired (_ssl.c:997)')))","Plan period extended to 2036 and housing requirement changed from 6615 to 6930 in MMs. ","https://s3.eu-west-2.amazonaws.com/local-plans/images/b3a6f957-a015-4ac6-8e92-c0aab6b423b2/87da7d10-d8ea-4369-9d63-da061bae4fd6.jpg","2019-04-30 14:12:38.465369","2025-03-21 01:28:42.597409","","2019-07-30","2020-03-31","2022-01-19","2022-02-22"
"local-authority-eng:HOR","Horsham District Council","E07000227","Development Framework","f7ab3008-a04e-4536-b285-10566f24f705","1568","2011","2031","True","HOUSING_REQUIREMENT_TOTAL","16000","","","","True","False","https://www.horsham.gov.uk/__data/assets/pdf_file/0006/28563/Horsham-District-Planning-Framework-2015.pdf","https://s3.eu-west-2.amazonaws.com/local-plans/plan-documents/f7ab3008-a04e-4536-b285-10566f24f705.pdf","eed862f188aad0f8569108ac57ac2843","An error occurred (InvalidAccessKeyId) when calling the PutObject operation: The AWS Access Key Id you provided does not exist in our records.","Meeting Crawley's unmet need of 3000 units","https://s3.eu-west-2.amazonaws.com/local-plans/images/f7ab3008-a04e-4536-b285-10566f24f705/a343546c-027d-4c01-a612-8c89cc561432.jpg","2019-04-30 14:12:39.804277","2025-03-21 01:30:12.196837","","2014-05-16","2014-08-08","2015-10-08","2015-11-27"
"local-authority-eng:HOR","Horsham District Council","E07000227","Horsham District Local Plan","71b85b9c-b693-4aa7-afb3-fa6e3aeaba0d","2116","2023","2040","True","HOUSING_REQUIREMENT_TOTAL","13212","","","","True","False","https://strategicplanning.horsham.gov.uk/gf2.ti/-/1583938/192184357.1/PDF/-/Horsham%20District%20Local%20Plan%20Regulation%2019.pdf","","","Document at https://strategicplanning.horsham.gov.uk/gf2.ti/-/1583938/192184357.1/PDF/-/Horsham%20District%20Local%20Plan%20Regulation%2019.pdf might not be a pdf","The minimum requirement will be split into an annual average requirement on a stepped basis as follows:
• Years 1-5 (2023/2024 – 2027/2028) 480 dwellings per annum;  
• Years 6-17 (2028/2029 – 2039/2040) 901 dwellings per annum.  
Earlier Reg 18 version (Feb-20) provided three options (see SP14) 1000 DPA/1200 DPA/1400 DPA","https://s3.eu-west-2.amazonaws.com/local-plans/images/71b85b9c-b693-4aa7-afb3-fa6e3aeaba0d/f1388dc3-95a6-4aaa-b676-61a6c63e4460.jpg","2020-09-22 13:43:59.424308","2025-03-21 01:05:08.640911","","2024-01-19","2024-07-26","",""
"local-authority-eng:HEF","Herefordshire Council","E06000019","Herefordshire Local Plan: Core Strategy","5d138aa0-fa2f-4767-9bbf-710a21e87ea0","1425","2011","2031","True","HOUSING_REQUIREMENT_TOTAL","16500","","","","True","False","https://www.herefordshire.gov.uk/download/downloads/id/1788/core_strategy_sections_combined.pdf","https://s3.eu-west-2.amazonaws.com/local-plans/plan-documents/5d138aa0-fa2f-4767-9bbf-710a21e87ea0.pdf","f96e91ecca5752a7556b388cce8b74a8","An error occurred (InvalidAccessKeyId) when calling the PutObject operation: The AWS Access Key Id you provided does not exist in our records.","See Page 32 of plan for the stepped target of 600 dpa for 2011-2016;  850 dpa for 2016-2021;  900 dpa for 2021-2026; and 950 dpa for 2026-2031.","https://s3.eu-west-2.amazonaws.com/local-plans/images/64ce4775-500b-4e16-b216-a2a5212e9946.jpg","2019-04-30 14:12:39.732406","2025-03-21 01:11:08.658515","","2014-05-22","2014-09-23","2015-09-29","2015-10-16"
"local-authority-eng:HEF","Herefordshire Council","E06000019","Herefordshire Local Plan 2021 - 2041","4708af29-49d4-471f-b324-c91b7b2e9029","2189","2021","2041","True","HOUSING_REQUIREMENT_TOTAL","9608","","","","True","False","https://www.herefordshire.gov.uk/downloads/file/26351/herefordshire-draft-local-plan-regulation-18-strategic-policies-document","","","An error occurred (InvalidAccessKeyId) when calling the PutObject operation: The AWS Access Key Id you provided does not exist in our records.","Number taken from the Draft Local Plan (Regulation
18) Strategic Policies Local Plan 2021-2041 consultation (March 2024).   See page 15 ""Under the present system, the standard method shows that around 805 dwellings per year over the next 20 years are required in Herefordshire to meet current housing need. This adds up to 16,100 dwellings during the plan period. (The plan period covers 20 years starting from 2021.) However, 6,512 homes have either already been built or granted planning permission since April 2021. Therefore, this means that the Local Plan needs to provide for only approximately 9,608 dwellings up to 2041.""","","2022-04-25 10:56:25.775261","2025-03-21 01:08:16.779437","","","","",""
"local-authority-eng:ELM","Elmbridge Borough Council","E07000207","Elmbridge Core Strategy","94ec63f6-5081-4e42-a23e-433f80d6b918","551","2011","2026","True","HOUSING_REQUIREMENT_TOTAL","3375","","","","True","False","https://www.elmbridge.gov.uk/EasySiteWeb/GatewayLink.aspx?alId=736","https://s3.eu-west-2.amazonaws.com/local-plans/plan-documents/94ec63f6-5081-4e42-a23e-433f80d6b918.pdf","da07f05d3c152a4a6742c98ceca510ab","404 Client Error: Not Found for url: https://www.elmbridge.gov.uk/EasySiteWeb/GatewayLink.aspx?alId=736","","https://s3.eu-west-2.amazonaws.com/local-plans/images/94ec63f6-5081-4e42-a23e-433f80d6b918/515f480c-1aec-472b-b4fe-184a09ea2368.jpg","2019-04-30 14:12:39.332564","2025-03-21 01:13:26.032366","","2010-01-11","2010-03-31","2011-06-13","2011-07-20"
"local-authority-eng:ELM","Elmbridge Borough Council","E07000207","Elmbridge New Local Plan - withdrawn 26 February 2025","45be6968-284f-4ef9-88eb-1f0a03a49c51","2147","2021","2037","True","HOUSING_REQUIREMENT_TOTAL","6785","","","","True","False","https://consult.elmbridge.gov.uk/gf2.ti/-/1205954/137701349.1/PDF/-/FINAL%20REG%2019%20DRAFT%20LOCAL%20PLAN%20_.pdf","","","Document at https://consult.elmbridge.gov.uk/gf2.ti/-/1205954/137701349.1/PDF/-/FINAL%20REG%2019%20DRAFT%20LOCAL%20PLAN%20_.pdf might not be a pdf","","https://s3.eu-west-2.amazonaws.com/local-plans/images/45be6968-284f-4ef9-88eb-1f0a03a49c51/046a2029-45a3-4055-bb84-859f0c7d9074.jpg","2019-04-30 14:12:38.643652","2025-03-21 01:26:04.109979","","2022-06-17","2023-08-10","",""
"local-authority-eng:ERY","East Riding of Yorkshire Council","E06000011","East Riding Local Plan Strategy Document","d9529aa8-ced5-44a8-b346-b8c71faa82da","1533","2012","2029","True","HOUSING_REQUIREMENT_YEARLY_AVERAGE","1400","","","","True","False","https://www.eastriding.gov.uk/EasySiteWeb/GatewayLink.aspx?alId=627778","https://s3.eu-west-2.amazonaws.com/local-plans/plan-documents/d9529aa8-ced5-44a8-b346-b8c71faa82da.pdf","335ec264e90687d99588d8d82677d134","404 Client Error: Not Found for url: https://www.eastriding.gov.uk/url/easysite-asset-627778/","The adopted East Riding Local Plan: Strategy Document
(April 2016) identifies a housing requirement of 1,400 homes per year. Hull’s requirement accommodates the 59 dwellings not allocated within the East Riding Local Plan: Strategy Document. This results in a Hull housing requirement for a minimum of 621 (net) homes per year, rounded to 620 (9,920 over the plan period). ","https://s3.eu-west-2.amazonaws.com/local-plans/images/d9529aa8-ced5-44a8-b346-b8c71faa82da/11d5aa3f-5f19-4c91-9794-868e4fce5b39.jpg","2019-04-30 14:12:39.293081","2025-03-21 01:08:14.559410","","2014-01-27","2014-04-28","2016-01-25","2016-04-06"
"local-authority-eng:ERY","East Riding of Yorkshire Council","E06000011","East Riding Local Plan Update 2020 - 2039","01fe0824-0be1-4c3b-aa4f-97206aff4edd","2036","2020","2039","True","HOUSING_REQUIREMENT_TOTAL","20900","","","","True","False","https://www.eastriding.gov.uk/EasySiteWeb/GatewayLink.aspx?alId=831356","","","An error occurred (InvalidAccessKeyId) when calling the PutObject operation: The AWS Access Key Id you provided does not exist in our records.","Figures from Reg 19 Plan (Oct 2022).  Average is 1,100 DPA.  Inspector's conclusion in his report at paragraph 
91: ""In conclusion, the identified housing requirement of 20,900 dwellings between 2020 and 2039 (1,100 dpa) in Policy S5 is justified and consistent with national policy.""
","https://s3.eu-west-2.amazonaws.com/local-plans/images/01fe0824-0be1-4c3b-aa4f-97206aff4edd/e066bec8-25bb-41a3-9767-ce24588eaff6.jpg","2020-11-04 10:52:32.034228","2025-03-21 01:30:08.002596","","2022-10-24","2023-03-31","2024-12-30",""
"local-authority-eng:EHA","East Hampshire District Council","E07000085","Joint Core Strategy (housing policy as clarified by the Part 2 Plan adopted on 7 April 2016)","2a7f1eb4-e1fb-4f69-a51b-8c64a480320f","919","2011","2028","True","HOUSING_REQUIREMENT_TOTAL","8366","","","","True","False","https://www.easthants.gov.uk/local-plan-part-2-housing-and-employment-allocations-pdf-25-mb","https://s3.eu-west-2.amazonaws.com/local-plans/plan-documents/2a7f1eb4-e1fb-4f69-a51b-8c64a480320f.pdf","bd2d3f734b2b811176f91e318b4d416c","404 Client Error: Not Found for url: https://www.easthants.gov.uk/local-plan-part-2-housing-and-employment-allocations-pdf-25-mb","The Joint Core Strategy shows the total housing provision (i.e. the number for BOTH East Hampshire and South Downs as 10,060 dwellings over the plan period of 2011-2028).  The Plan now only relates to East Hampshire as South Downs have a ‘new’ adopted plan for their area.  The number was disaggregated in East Hampshire’s Housing and Employment Allocations Plan (a Part 2 Plan) adopted in April 2016. The disaggregated figure given for East Hampshire is 8,366 (outside the South Downs NP's area). 
","https://s3.eu-west-2.amazonaws.com/local-plans/images/2a7f1eb4-e1fb-4f69-a51b-8c64a480320f/23d47ea0-9310-4f6c-965a-4ec822fdf7c8.jpg","2019-04-30 14:12:39.203043","2025-03-21 01:30:05.179001","","2012-02-03","2012-05-25","2014-04-15","2014-05-08"
"local-authority-eng:EHA","East Hampshire District Council","E07000085","East Hampshire Local Plan","8f82c5d5-bf7a-4a25-b233-2639606ccd80","2146","2021","2040","True","HOUSING_REQUIREMENT_YEARLY_AVERAGE","478","","","","True","False","https://www.easthants.gov.uk/media/8743/download?inline","","","An error occurred (InvalidAccessKeyId) when calling the PutObject operation: The AWS Access Key Id you provided does not exist in our records.","Reg 18 (2) provides 9,082 homes overall between 2021 and 2040 (or 478 DPA). The figure of 10,982 overall (2021-2040) (or 578 DPA) includes the South Downs NP area).  The earlier Reg 18(1) of Nov-22 provided a DPA of 632 (but this can be disaggregated to 517 for E Hants and 115 for SDNP).
","https://s3.eu-west-2.amazonaws.com/local-plans/images/8f82c5d5-bf7a-4a25-b233-2639606ccd80/faae192c-29c1-47a4-8b49-74ce6cac6f33.jpg","2019-04-30 14:12:40.379335","2025-03-21 01:18:13.384631","","","","",""
"local-authority-eng:EHE","East Hertfordshire District Council","E07000242","East Herts District Plan 2018","daf38f0d-dcf2-4d3c-abc6-7d71958088d5","1794","2011","2033","True","HOUSING_REQUIREMENT_TOTAL","18458","","","","True","False","https://www.eastherts.gov.uk/media/33185/East-Herts-District-Plan-2018-web-view/PDF/District_Plan_Publish_web_view.pdf","https://s3.eu-west-2.amazonaws.com/local-plans/plan-documents/daf38f0d-dcf2-4d3c-abc6-7d71958088d5.pdf","746a6067b5fce3f439bf1793019e5c60","503 Server Error: Service Temporarily Unavailable for url: https://www.eastherts.gov.uk/media/33185/East-Herts-District-Plan-2018-web-view/PDF/District_Plan_Publish_web_view.pdf","","https://s3.eu-west-2.amazonaws.com/local-plans/images/daf38f0d-dcf2-4d3c-abc6-7d71958088d5/c3f911e8-1279-47a5-b88f-2975d193920b.jpg","2019-04-30 14:12:39.258918","2025-03-21 01:29:05.997892","","2016-11-03","2017-03-31","2018-07-10","2018-10-23"
"local-authority-eng:DOV","Dover District Council","E07000108","New Dover District Plan","fa79d9ed-c6eb-4908-82ce-5c260707132d","2117","2020","2040","True","HOUSING_REQUIREMENT_TOTAL","10998","","","","True","False","https://www.doverdistrictlocalplan.co.uk/uploads/pdfs/Dover-District-Local-Plan-Regulation-19-Submission-Document-Oct-2022.pdf","","","An error occurred (InvalidAccessKeyId) when calling the PutObject operation: The AWS Access Key Id you provided does not exist in our records.","Reg 19 document (Oct 2022) reduces the housing figure to 10,998 (previous Regulation 18 Draft Plan (Jan 2021) showed a figure of 11,920 homes).  The Reg 19 version was submitted for examination (March 2023). Unchanged following examination. ","https://s3.eu-west-2.amazonaws.com/local-plans/images/fa79d9ed-c6eb-4908-82ce-5c260707132d/7ae1b0a4-af1d-41f3-aa11-b4ead8288f42.jpg","2020-09-22 10:55:46.089515","2025-03-21 01:29:57.716994","","2022-10-21","2023-03-31","2024-09-20","2024-10-16"
"local-authority-eng:FEN","Fenland District Council","E07000010","Fenland Local Plan","7d89e3cb-d5e6-4271-9cf9-532eb25c452c","629","2011","2031","True","HOUSING_REQUIREMENT_TOTAL","11000","","","","True","False","https://www.fenland.gov.uk/media/12064/Fenland-Local-Plan---Adopted-2014/pdf/Fenland_Local_Plan-Adopted_2014.pdf","https://s3.eu-west-2.amazonaws.com/local-plans/plan-documents/7d89e3cb-d5e6-4271-9cf9-532eb25c452c.pdf","be2e423bd3d7ebb85c72ff8a15d6d1ed","An error occurred (InvalidAccessKeyId) when calling the PutObject operation: The AWS Access Key Id you provided does not exist in our records.","","https://s3.eu-west-2.amazonaws.com/local-plans/images/7d89e3cb-d5e6-4271-9cf9-532eb25c452c/7672dbd3-ca20-414d-9b21-225267c43524.jpg","2019-04-30 14:12:39.414592","2025-03-21 01:29:56.517492","","2013-02-28","2013-09-04","2014-04-09","2014-05-08"
"local-authority-eng:FEN","Fenland District Council","E07000010","Fenland Local Plan 2021 - 2040","5bd289a8-af25-4401-be84-483f14b6db80","2218","2021","2040","True","HOUSING_REQUIREMENT_TOTAL","10525","","","","True","False","https://www.fenland.gov.uk/media/18814/Draft-Local-Plan-August-2022/pdf/Draft_Local_Plan_for_Consultation_Aug_2022.pdf?m=637967739565370000","https://s3.eu-west-2.amazonaws.com/local-plans/plan-documents/5bd289a8-af25-4401-be84-483f14b6db80.pdf","8a981b5d2de2e5bcabc916b93b023da2","An error occurred (InvalidAccessKeyId) when calling the PutObject operation: The AWS Access Key Id you provided does not exist in our records.","Housing numbers taken from Draft Local Plan (August 2022).  Overall requirement is 10,525 for plan period (2021-2040) with 517 DPA for one year 1 April 2021 - 31 March 2022; and 556 DPA for 18 years 1 April 2022 - 31 March 2040.","https://s3.eu-west-2.amazonaws.com/local-plans/images/5bd289a8-af25-4401-be84-483f14b6db80/642d36f0-45b8-4895-a58a-0fdfa253b8a8.jpg","2020-09-23 09:37:50.856150","2025-03-21 01:23:49.603157","","","","",""
"local-authority-eng:EDO","East Dorset District Council","E07000049","Christchurch and East Dorset Local Plan Part 1 - Core Strategy","8b48f728-8835-4b44-8f1a-d41101baeda1","398","2013","2028","True","HOUSING_REQUIREMENT_TOTAL","","","","8490","True","True","https://www.dorsetforyou.gov.uk/planning-buildings-land/planning-policy/christchurch/local-development-framework/local-plan-part-1/pdfs/local-plan-part-1/christchurch-and-east-dorset-adopted-core-strategy.pdf","https://s3.eu-west-2.amazonaws.com/local-plans/plan-documents/8b48f728-8835-4b44-8f1a-d41101baeda1.pdf","b8a787890fa8be74c4bfcbfe7503f19a","HTTPSConnectionPool(host='www.dorsetforyou.gov.uk', port=443): Max retries exceeded with url: /planning-buildings-land/planning-policy/christchurch/local-development-framework/local-plan-part-1/pdfs/local-plan-part-1/christchurch-and-east-dorset-adopted-core-strategy.pdf (Caused by NewConnectionError('<urllib3.connection.HTTPSConnection object at 0x7f8f4b46c100>: Failed to establish a new connection: [Errno -5] No address associated with hostname'))","","https://s3.eu-west-2.amazonaws.com/local-plans/images/8ffc1244-d35f-46e5-870b-33d86c245a5f.jpg","2019-04-30 14:12:39.238384","2025-03-21 01:30:20.531316","","2012-04-02","2013-03-15","2014-03-21","2014-04-28"
"local-authority-eng:GLO","Gloucester City Council","E07000081","Gloucester, Cheltenham and Tewkesbury Joint Core Strategy","8cecfc29-1e2c-442c-9525-6138c62b00d8","1109","2011","2031","True","HOUSING_REQUIREMENT_TOTAL","14359","","","","True","True","https://www.jointcorestrategy.org/adopted-joint-core-strategy","","","Document at https://www.jointcorestrategy.org/adopted-joint-core-strategy might not be a pdf","CHELTENHAM: See  Appendices para 7.135 for stepped requirement: 2011-2022: 450 DPA; 2022-2031: 663 DPA.  In terms of unmet need in both Cheltenham and Gloucester, this will be met by Tewkesbury  2610 to Cheltenham; and 4895 to Gloucester.","https://s3.eu-west-2.amazonaws.com/local-plans/images/8cecfc29-1e2c-442c-9525-6138c62b00d8/e802e5b1-ed61-4970-9d8e-07bf34fb798a.jpg","2019-04-30 14:12:38.735009","2025-03-21 01:18:22.347343","","2014-06-30","2014-11-20","2017-10-26","2017-12-11"
"local-authority-eng:GLO","Gloucester City Council","E07000081","Gloucester, Cheltenham and Tewkesbury Joint Core Strategy Review","0677afdc-f4da-48c2-9d13-5f80dd479cd3","2142","2021","2036","True","HOUSING_REQUIREMENT_TOTAL","","","","35600","True","True","https://www.jointcorestrategy.org/joint-core-strategy-review","","","404 Client Error: Not Found for url: https://www.jointcorestrategy.org/joint-core-strategy-review","","https://s3.eu-west-2.amazonaws.com/local-plans/images/0677afdc-f4da-48c2-9d13-5f80dd479cd3/a2c6bdce-6538-4397-bb99-1f60e5f98c30.jpg","2019-04-30 14:12:40.452986","2025-03-21 01:32:34.419377","","","","",""
"local-authority-eng:ELI","East Lindsey District Council","E07000137","East Lindsey Local Plan: Core Strategy","aa7f9c07-780e-44de-a32b-1f9b1ff13e13","1803","2017","2031","True","HOUSING_REQUIREMENT_TOTAL","7819","","","","True","False","https://www.e-lindsey.gov.uk/media/9791/Core-Strategy/pdf/Final_Version_of_Core_Strategy_2018.pdf?m=636821922732300000","https://s3.eu-west-2.amazonaws.com/local-plans/plan-documents/aa7f9c07-780e-44de-a32b-1f9b1ff13e13.pdf","214c37486f1ba12d44ea4c9355bd791c","An error occurred (InvalidAccessKeyId) when calling the PutObject operation: The AWS Access Key Id you provided does not exist in our records.","","https://s3.eu-west-2.amazonaws.com/local-plans/images/aa7f9c07-780e-44de-a32b-1f9b1ff13e13/f8ec29e5-9b2e-4857-9599-718eab186746.jpg","2019-04-30 14:12:39.281259","2025-03-21 01:28:48.663972","","2016-11-30","2017-04-18","2018-05-03","2018-07-18"
"local-authority-eng:ELI","East Lindsey District Council","E07000137","East Lindsey Local Plan Partial Review 2022-2041","8b4260ee-009c-498c-ac3b-25c4750bf766","2165","2022","2041","True","","","","","","False","False","","","","","","","2021-06-29 10:15:17.044550","2021-06-29 10:15:31.787382","robert.putnam","","","",""
"local-authority-eng:GRY","Great Yarmouth Borough Council","E07000145","Core Strategy 2013-2030 (as modified by Part 2 Plan, adopted 9 December 2021)","b160db07-8136-4698-b19b-ddf7db61ec9c","269","2013","2030","True","HOUSING_REQUIREMENT_TOTAL","5303","","","","True","False","https://www.great-yarmouth.gov.uk/article/2489/Current-Local-Plan","","","Document at https://www.great-yarmouth.gov.uk/article/2489/Current-Local-Plan might not be a pdf","Core Strategy adopted 2015 superseded: Stepped requirement: years 1-7: 300 DPA; Years 8-17: 504 DPA.  Overall figure for plan period is 7140, DPA is 420.
Housing requirement amended by Part 2 Plan adopted 9 December 2021 to 5,303 homes.  Annual average is 312 DPA. New stepped requirement: 218 for years 1-7 & 363 for years 8-17.","https://s3.eu-west-2.amazonaws.com/local-plans/images/b160db07-8136-4698-b19b-ddf7db61ec9c/d1d6658f-96db-4c5f-9559-1379d51c2d92.jpg","2019-04-30 14:12:39.435987","2025-03-21 01:05:08.468523","","2013-09-27","2014-03-31","2015-11-30","2015-12-21"
