"planning_authority","name","ons_code","plan_title","plan_id","local_development_framework_number","start_year","end_year","plan_period_found","housing_number_type","number","min","max","joint_plan_total","housing_numbers_found","is_joint_plan","source_document","cached_source_document","source_document_checksum","error_caching_source_document","notes","screenshot","created_date","updated_date","last_updated_by","published","submitted","found_sound","adopted"
"local-authority-eng:WRT","Warrington Borough Council","E06000007","Warrington Local Plan 2021/22 – 2038/39","700c13cc-11f3-4b83-b7cd-c3b47e655842","2092","2021","2039","True","HOUSING_REQUIREMENT_TOTAL","14688","","","","True","False","https://www.warrington.gov.uk/sites/default/files/2021-09/warrington_updated_proposed_submission_version_local_plan_upsvlp_2021-2038_-_september_2021.pdf","https://s3.eu-west-2.amazonaws.com/local-plans/plan-documents/700c13cc-11f3-4b83-b7cd-c3b47e655842.pdf","fe5123c0f02afebcac101bf682d44b0f","403 Client Error: Forbidden for url: https://www.warrington.gov.uk/sites/default/files/2021-09/warrington_updated_proposed_submission_version_local_plan_upsvlp_2021-2038_-_september_2021.pdf","Objective W1: To enable the sustainable growth of Warrington through the ongoing regeneration of Inner Warrington, the delivery of strategic and local infrastructure, the strengthening of existing neighbourhoods and the creation of new sustainable neighbourhoods whilst:
• delivering a minimum of 14,688 new homes (equating to 816 per year) between 2021/22 and 2038/39, and
• supporting Warrington’s ongoing economic success by meeting the need for 168 hectares of employment land between 2021/22 and 2038/39.","https://s3.eu-west-2.amazonaws.com/local-plans/images/700c13cc-11f3-4b83-b7cd-c3b47e655842/ebc7e699-d848-4c78-bf8f-a975722b4231.jpg","2019-04-30 14:12:38.982635","2025-03-21 01:02:50.689165","","2019-04-15","2022-04-22","2023-10-23","2023-12-04"
"local-authority-eng:WEL","Wellingborough Borough Council","E07000156","North Northamptonshire Joint Core Strategy 2011-2031","b818aff3-bd8a-4243-8e7a-e4ac402182de","1367","2011","2031","True","HOUSING_REQUIREMENT_TOTAL","7000","","","","True","True","http://www.nnjpdu.org.uk/site/assets/files/1086/joint_core_strategy_2011-2031_high_res_version_for_website.pdf","https://s3.eu-west-2.amazonaws.com/local-plans/plan-documents/b818aff3-bd8a-4243-8e7a-e4ac402182de.pdf","6ed68a77e7b4a3719d390cef841e8e9a","403 Client Error:  for url: https://www.nnjpdu.org.uk/site/assets/files/1086/joint_core_strategy_2011-2031_high_res_version_for_website.pdf","9,200 requirement for Corby excludes 'strategic opportunity'.","https://s3.eu-west-2.amazonaws.com/local-plans/images/b818aff3-bd8a-4243-8e7a-e4ac402182de/d93d6e2c-d2f7-4669-95ca-49e06522d306.jpg","2019-04-30 14:12:39.276064","2025-03-21 01:23:48.306046","","2015-01-26","2015-07-31","2016-06-22","2016-07-14"
"local-authority-eng:WND","London Borough of Wandsworth","E09000032","Local Plan: Full Review","0a826f3f-f7ce-42e0-9695-0f236c11cc89","2266","2023","2038","True","HOUSING_REQUIREMENT_TOTAL","20311","","","","True","False","https://www.wandsworth.gov.uk/media/large/adopted_local_plan.pdf","https://s3.eu-west-2.amazonaws.com/local-plans/plan-documents/0a826f3f-f7ce-42e0-9695-0f236c11cc89.pdf","3bffff81fe6e2e1ddde7eff7d9ea7e58","","Within the period 2023 – 2038 the Local Plan will provide for a minimum of 20,311 new homes. This includes
the provision of a minimum of 1,950 new homes per year up until 2028/2029, including on small sites. The
small sites provision across the entire Plan period will account for a minimum of 414 new homes per year
(see also Policy LP7).","https://s3.eu-west-2.amazonaws.com/local-plans/images/0a826f3f-f7ce-42e0-9695-0f236c11cc89/51b5f307-9e5e-429d-bbea-e8adc62a2d55.jpg","2020-11-16 14:53:47.356837","2025-03-21 01:18:46.112994","","2022-01-10","2022-04-29","2023-06-23","2023-07-19"
"local-authority-eng:WBK","West Berkshire Council","E06000037","West Berkshire Core Strategy DPD","69d8a719-df50-4f2a-a6ce-3f905b07f1e3","1050","2006","2026","True","HOUSING_REQUIREMENT_TOTAL","10500","","","","True","False","https://info.westberks.gov.uk/CHttpHandler.ashx?id=36374&p=0","https://s3.eu-west-2.amazonaws.com/local-plans/plan-documents/69d8a719-df50-4f2a-a6ce-3f905b07f1e3.pdf","b9d8674a56a647f5400b8ce3b8e66c04","('Connection aborted.', ConnectionResetError(104, 'Connection reset by peer'))","","https://s3.eu-west-2.amazonaws.com/local-plans/images/69d8a719-df50-4f2a-a6ce-3f905b07f1e3/23a873a5-d8ed-4b81-9790-769ec644b393.jpg","2019-04-30 14:12:38.511976","2025-03-21 01:23:42.166431","","2010-04-09","2010-07-12","2012-07-03","2012-07-16"
"local-authority-eng:WBK","West Berkshire Council","E06000037","West Berkshire Local Plan Review 2022 - 2039","071175c1-5f10-43dd-8ff9-97e3db1b8912","2162","2022","2039","True","HOUSING_REQUIREMENT_YEARLY_RANGE","","513","538","","True","False","https://www.westberks.gov.uk/media/53945/Proposed-Submission-Regulation-19-West-Berkshire-Local-Plan-Review-to-2039-Clean-Version/pdf/LPR_2022-2039_Proposed_Submission_for_consultation_20_Jan_2023_for_web.pdf?m=638096652954630000","https://s3.eu-west-2.amazonaws.com/local-plans/plan-documents/071175c1-5f10-43dd-8ff9-97e3db1b8912.pdf","6a0304f7990b8d89c0dfee252e739858","500 Server Error: Internal Server Error for url: https://www.westberks.gov.uk/media/53945/Proposed-Submission-Regulation-19-West-Berkshire-Local-Plan-Review-to-2039-Clean-Version/pdf/LPR_2022-2039_Proposed_Submission_for_consultation_20_Jan_2023_for_web.pdf?m=638096652954630000","Provision will be made for 8,721 to 9,146 net additional homes in West Berkshire for the period 1 April 2022 to
31 March 2039; 513 to 538 dwellings per annum.","https://s3.eu-west-2.amazonaws.com/local-plans/images/071175c1-5f10-43dd-8ff9-97e3db1b8912/ef4093d4-93b0-4874-9ace-42cd8b446b16.jpg","2019-07-18 22:52:53.200474","2025-03-21 01:21:00.175157","","2023-01-20","2023-03-31","",""
"local-authority-eng:WYR","Wyre Borough Council","E07000128","Wyre Local Plan (2011-2031) incorporating partial update of 2022","7d71a80f-3f1a-4e5b-9620-63ddb21772b4","2248","2011","2031","True","HOUSING_REQUIREMENT_TOTAL","7384","","","","True","False","https://www.wyre.gov.uk/downloads/file/1283/local-plan-partial-review-schedule-of-revisions","https://s3.eu-west-2.amazonaws.com/local-plans/plan-documents/7d71a80f-3f1a-4e5b-9620-63ddb21772b4.pdf","82f6a9b37458840dac9725d2ef6dd436","","The housing requirement figure for the Wyre Local Plan Partial Review (2011 – 2031) (incorporating partial update of 2022) is 296 net dwellings per annum.  The total housing requirement for the Plan Period is therefore a minimum of  7,384 net dwellings.  This consists of  479 net dwellings between 2011 and 2018/2019; and 296 net dwellings between 2019/2020 and 2031.  

Not included in Wyre Local Plan but Fylde will take account of Wyre's unmet need of 380 units. https://new.fylde.gov.uk/wp-content/uploads/2021/10/Inspectors-Final-Report-and-Appendix.pdf ","https://s3.eu-west-2.amazonaws.com/local-plans/images/7d71a80f-3f1a-4e5b-9620-63ddb21772b4/56eb5f5e-4946-4ccf-9089-1aa52323f24e.jpg","2021-12-10 18:10:16.867696","2025-03-21 01:08:18.218919","","2021-11-30","2022-04-25","2022-12-20","2023-01-26"
"local-authority-eng:WLL","Walsall Metropolitan Borough Council","E08000030","Black Country Core Strategy 2011","95690c16-7ad0-4b4d-9581-fc267e0f0537","766","2006","2026","True","HOUSING_REQUIREMENT_TOTAL","11973","","","","True","True","http://blackcountrycorestrategy.dudley.gov.uk/EasysiteWeb/getresource.axd?AssetID=198681&type=full&servicetype=Attachment","","","404 Client Error: Not Found for url: https://blackcountryplan.dudley.gov.uk/EasysiteWeb/getresource.axd?AssetID=198681&type=full&servicetype=Attachment","See bottom of Table 7 for phased targets.  
Dudley: 2006-2016: 811.2 DPA; 2016-2021: 534 DPA; 2021-2026: 1069 DPA.  Sandwell: 2006-2016: 742.1 DPA; 2016-2021: 938 DPA; 2021-2026: 1876 DPA.  Walsall: 2006-2016: 506.7 DPA; 2016-2021: 460 DPA; 2021-2026: 921.2.  Wolverhampton: 2006-2016: 566.2; 2016-2021: 516 DPA; 2021-2026: 1034 DPA.","https://s3.eu-west-2.amazonaws.com/local-plans/images/95690c16-7ad0-4b4d-9581-fc267e0f0537/e00ac111-9f61-4285-b906-656832bb9166.jpg","2019-04-30 14:12:40.883369","2025-03-21 01:11:13.247828","","2009-11-30","2010-02-26","2010-10-15","2011-02-03"
"local-authority-eng:WAE","Waverley Borough Council","E07000216","Local Plan Part 1: Strategic Policies and Sites","5e0e69fb-6794-428b-82e1-aa81dadad2c6","1779","2013","2032","True","HOUSING_REQUIREMENT_TOTAL","11210","","","","True","False","https://www.waverley.gov.uk/download/downloads/id/5974/waverley_local_plan_part_1_chapters_only.pdf","","","404 Client Error: Not Found for url: https://www.waverley.gov.uk/download/downloads/id/5974/waverley_local_plan_part_1_chapters_only.pdf","Meeting Woking's unmet housing need of 1577 units","https://s3.eu-west-2.amazonaws.com/local-plans/images/5e0e69fb-6794-428b-82e1-aa81dadad2c6/cbee9f7b-d267-4126-adf1-80da5855d1d9.jpg","2019-04-30 14:12:38.345871","2025-03-21 01:18:36.510721","","2016-08-19","2016-12-21","2018-02-01","2018-02-20"
"local-authority-eng:WOC","Worcester City Council","E07000237","South Worcestershire Development Plan","868e439e-f1c0-41a1-b952-d9db2beb06c2","1402","2006","2030","True","HOUSING_REQUIREMENT_TOTAL","6800","","","","True","True","http://www.swdevelopmentplan.org/wp-content/uploads/2016/06/The-Adopted-SWDP-February-2016.pdf","https://s3.eu-west-2.amazonaws.com/local-plans/plan-documents/868e439e-f1c0-41a1-b952-d9db2beb06c2.pdf","6c851762c881598a7cd9e5d3d2f309da","404 Client Error: Not Found for url: https://www.swdevelopmentplan.org/wp-content/uploads/2016/06/The-Adopted-SWDP-February-2016.pdf","Malvern Hills: Comprises 4,450 in the Wider Worcester Area (WWA) and 5,650 outside the WWA. Wychavon: Comprises 900 in the WWA and 10,600 outside the WWA.","https://s3.eu-west-2.amazonaws.com/local-plans/images/868e439e-f1c0-41a1-b952-d9db2beb06c2/b6038b1e-ec1e-4db9-8988-51f1d7101634.jpg","2019-04-30 14:12:40.197912","2025-03-21 01:29:58.680037","","2013-01-11","2013-05-28","2016-02-04","2016-02-25"
"local-authority-eng:WOC","Worcester City Council","E07000237","South Worcestershire Development Plan Review","2458d797-2eb5-4c29-a1cc-93c10bf58b9f","2137","2021","2041","True","HOUSING_REQUIREMENT_TOTAL","","","","26360","True","True","https://www.swdevelopmentplan.org/component/fileman/file/Documents/SWDPR%20Reg%2019%20Docs/Accessible%20SWDP%20Review%20Regulation%2019%20%281%29.pdf?routed=1&container=fileman-files","","","Document at https://www.swdevelopmentplan.org/component/fileman/file/Documents/SWDPR%20Reg%2019%20Docs/Accessible%20SWDP%20Review%20Regulation%2019%20%281%29.pdf?routed=1&container=fileman-files might not be a pdf","Plan provides for 25,860 homes 2021-2041, plus 500 for Mitton/Tewkesbury = 26,360.","https://s3.eu-west-2.amazonaws.com/local-plans/images/2458d797-2eb5-4c29-a1cc-93c10bf58b9f/218a2eec-e995-43d6-9786-a997d227e16e.jpg","2019-05-15 13:31:07.504870","2025-03-21 01:23:41.564129","","2022-11-01","2023-09-27","",""
"local-authority-eng:WSM","City of Westminster","E09000033","City Plan 2019-2040","230c6f1d-7a1c-4765-981f-4ef2850d3e5a","1997","2019","2040","True","HOUSING_REQUIREMENT_TOTAL","20685","","","","True","False","https://www.westminster.gov.uk/media/document/city-plan-2019-2040","https://s3.eu-west-2.amazonaws.com/local-plans/plan-documents/230c6f1d-7a1c-4765-981f-4ef2850d3e5a.pdf","534684033ae47bff0bd42e66606dae3c","500 Server Error: Internal Server Error for url: https://www.westminster.gov.uk/media/document/city-plan-2019-2040","Includes stepped requirement of 1,495 homes/annum in the first 10 years of the plan.","https://s3.eu-west-2.amazonaws.com/local-plans/images/230c6f1d-7a1c-4765-981f-4ef2850d3e5a/e9227774-1717-4484-a417-93969b7754a8.jpg","2019-07-02 15:48:32.532610","2025-03-21 01:10:49.686089","","2019-06-19","2019-11-19","2021-03-19","2021-04-21"
"local-authority-eng:WSM","City of Westminster","E09000033","Westminster City Plan Partial Review","e7bd8c7e-3ac6-42fb-b430-7067077f4e28","2404","2019","2040","True","HOUSING_REQUIREMENT_YEARLY_AVERAGE","1495","","","","True","False","https://www.westminster.gov.uk/media/document/regulation-19-city-plan","","","An error occurred (InvalidAccessKeyId) when calling the PutObject operation: The AWS Access Key Id you provided does not exist in our records.","12. Housing delivery:  A. The number of new homes built in
Westminster will exceed the London Plan derived figure of 20,685 over the Plan period. The target allocated to Westminster in the London Plan is 985 homes per year over ten years.  Using the standard approach, this results in an annual requirement of 1,495 homes per year for Westminster (see Ch 12, p.80 of Reg 19 plan dated March 2024).  Trajectory at page 81 Fig 23.","","2023-08-17 14:49:45.475166","2025-03-21 01:05:58.157593","","2024-03-14","2024-11-28","",""
"local-authority-eng:WDE","West Devon Borough Council","E07000047","Plymouth & South West Devon Plan","ac0c21f8-0035-4190-ac6d-31803fc784f4","1819","2014","2034","True","HOUSING_REQUIREMENT_TOTAL","","","","26700","True","True","https://www.plymouth.gov.uk/plymouthandsouthwestdevonjointlocalplan/plymouthandsouthwestdevonjointlocalplanadoption","","","Document at https://www.plymouth.gov.uk/plymouthandsouthwestdevonjointlocalplan/plymouthandsouthwestdevonjointlocalplanadoption might not be a pdf","","https://s3.eu-west-2.amazonaws.com/local-plans/images/ac0c21f8-0035-4190-ac6d-31803fc784f4/4e17ef02-c0b9-4f3e-8702-324a50460e6c.jpg","2019-04-30 14:12:41.071961","2025-03-21 01:06:02.498436","","2017-03-15","2017-07-31","2019-03-18","2019-03-26"
"local-authority-eng:FAR","Fareham Borough Council","E07000087","Fareham Local Plan 2037","808859ce-cbc7-4a34-86eb-67b002c2db8f","1927","2021","2037","True","HOUSING_REQUIREMENT_TOTAL","9560","","","","True","False","https://www.fareham.gov.uk/PDF/planning/local_plan/CD001_Revised_Publication_Local_Plan.pdf","https://s3.eu-west-2.amazonaws.com/local-plans/plan-documents/808859ce-cbc7-4a34-86eb-67b002c2db8f.pdf","92c94761ffd841d2e01e8deda22dfa8e","500 Server Error: URL Rewrite Module Error. for url: https://www.fareham.gov.uk/PDF/planning/local_plan/CD001_Revised_Publication_Local_Plan.pdf","Strategic Policy H1: Housing Provision

The Council will make provision for at least 9,560 net new homes across the Borough during the Plan period of
2021-2037, phased as follows,

     At least 420 dwellings (averaging 210 dwellings per annum) between 2021/22 and 2022/23,

     At least 9,140 dwellings (averaging 653 dwellings per annum) between  2023/24 and 2036/37

Taken from Adopted Plan (April 2023)","https://s3.eu-west-2.amazonaws.com/local-plans/images/808859ce-cbc7-4a34-86eb-67b002c2db8f/1a85ae42-8894-4523-bdb9-e55c8a65ca37.jpg","2019-04-30 14:12:40.291660","2025-03-21 01:28:46.483544","","2020-11-06","2021-09-30","2023-03-23","2023-04-05"
"local-authority-eng:WLV","City of Wolverhampton Council","E08000031","Black Country Core Strategy 2011","95690c16-7ad0-4b4d-9581-fc267e0f0537","766","2006","2026","True","HOUSING_REQUIREMENT_TOTAL","13411","","","","True","True","http://blackcountrycorestrategy.dudley.gov.uk/EasysiteWeb/getresource.axd?AssetID=198681&type=full&servicetype=Attachment","","","404 Client Error: Not Found for url: https://blackcountryplan.dudley.gov.uk/EasysiteWeb/getresource.axd?AssetID=198681&type=full&servicetype=Attachment","See bottom of Table 7 for phased targets.  
Dudley: 2006-2016: 811.2 DPA; 2016-2021: 534 DPA; 2021-2026: 1069 DPA.  Sandwell: 2006-2016: 742.1 DPA; 2016-2021: 938 DPA; 2021-2026: 1876 DPA.  Walsall: 2006-2016: 506.7 DPA; 2016-2021: 460 DPA; 2021-2026: 921.2.  Wolverhampton: 2006-2016: 566.2; 2016-2021: 516 DPA; 2021-2026: 1034 DPA.","https://s3.eu-west-2.amazonaws.com/local-plans/images/95690c16-7ad0-4b4d-9581-fc267e0f0537/e00ac111-9f61-4285-b906-656832bb9166.jpg","2019-04-30 14:12:40.883369","2025-03-21 01:11:13.247828","","2009-11-30","2010-02-26","2010-10-15","2011-02-03"
"local-authority-eng:WLV","City of Wolverhampton Council","E08000031","Wolverhampton Local Plan","8a9a05bb-eb31-4606-b53c-c107ea94d55f","2326","2024","2042","True","HOUSING_REQUIREMENT_TOTAL","9330","","","","True","False","https://www.wolverhampton.gov.uk/sites/default/files/2024-11/Main%20Document%20WLP%20Reg%2019.pdf","","","An error occurred (InvalidAccessKeyId) when calling the PutObject operation: The AWS Access Key Id you provided does not exist in our records.","Policy HOU1 – Delivering Sustainable Housing Growth
Sufficient land will be provided to deliver at least 9,330 net new homes over the Plan period 2024 – 2042. 
The minimum housing target over the period 2024-42 and for each of the Plan phases: 2024-32, 2032-37 and 2037-42 is set out in Table 4.","","2024-05-14 09:11:11.394445","2025-03-21 01:29:02.751005","","2024-11-25","","",""
"local-authority-eng:WNM","Royal Borough of Windsor and Maidenhead","E06000040","Borough Local Plan","b2a226dd-f994-49c6-8b18-7e564c66d265","1844","2013","2033","True","HOUSING_REQUIREMENT_TOTAL","14240","","","","True","False","https://consult.rbwm.gov.uk/file/5967538","","","Document at https://consult.rbwm.gov.uk/file/5967538 might not be a pdf","New housing will be delivered in accordance with the following stepped housing requirement in the
remaining years of the Plan period:  Year 9: (2021/22): 200 dwellings; Year 10: (2022/23) 400 dwellings; Year 11: (2023/24) 1,400 dwellings; Year 12: (2024/25) 1,400 dwellings; Year 13: (2025/26) 1,400 dwellings; Year 14: (2026/27) 775 dwellings; Year 15: (2027/28)  775 dwellings; Year 16 (2028/29) 775 dwellings; Year 17 (2029/30) 775 dwellings; Year 18 (2030/31) 775 dwellings; Year 19 (2031/32) 775 dwellings; Year 20 (2032/33) 772 dwellings.","https://s3.eu-west-2.amazonaws.com/local-plans/images/b2a226dd-f994-49c6-8b18-7e564c66d265/e395cac9-9d95-469c-9f3b-b68d98cfca3e.jpg","2019-04-30 14:12:39.749850","2025-03-21 01:06:02.701284","","2017-06-30","2018-01-31","2022-01-26","2022-02-08"
"local-authority-eng:VAL","Vale of White Horse District Council","E07000180","Local Plan 2031 Part 1: Strategic Sites and Policies (as modified by Part 2 Plan, 9 Oct 2019)","5c914e72-2d3c-4d5a-b85c-038d82b79e64","832","2011","2031","True","HOUSING_REQUIREMENT_TOTAL","22760","","","","True","False","https://www.whitehorsedc.gov.uk/wp-content/uploads/sites/3/2021/03/VOWHDC-Master-1.pdf","","","An error occurred (InvalidAccessKeyId) when calling the PutObject operation: The AWS Access Key Id you provided does not exist in our records.","Unmet housing need in Oxford (2,200) in VoWH.   The Council have defined the unmet need (to be added to the housing requirement of 20560) as 2,200 – and that this applies to the whole plan period (See Core Policy 4a).  We consider that this revisits the housing requirement because there is an increase in the housing requirement set out in the adopted development plan; i.e. they haven’t simply just factored completions since adoption of the previous plan, but through duty to cooperate clarified the quantum of unmet need to be met and increased the housing requirement accordingly [Part 2 plan adopted 9 October 2019].  

""Stepped Requirement"" = 2011 – 2019: 1,028 dpa;  
2019 – 2031: 1,211 dpa. 

(The DPA of 1,028 is the average for the 20 year plan period (20,560 overall).  

The LPA has then taken the total 1,028 x 8 = 8,224 off the new overall total of 22,760 to reach 14,536, and then divided that by the number of years left in the plan (12) to reach a DPA of 1,211.  

22,760 – 8,224 = 14,536
14,536 / 12 = 1,211 DPA)
","https://s3.eu-west-2.amazonaws.com/local-plans/images/5c914e72-2d3c-4d5a-b85c-038d82b79e64/8c446262-316b-4b72-9ba5-af9f8c1edb0f.jpg","2019-04-30 14:12:38.366583","2025-03-21 01:13:25.736873","","2014-11-07","2015-03-18","2016-11-30","2016-12-14"
"local-authority-eng:VAL","Vale of White Horse District Council","E07000180","Joint Local Plan 2041","a8b9e8d0-7306-4ada-b9d5-b22a0f5eb9d6","2168","2021","2041","True","HOUSING_REQUIREMENT_TOTAL","14490","","","","True","True","https://jlp.southandvale.gov.uk/apps/fde1c3efcad442309b35c2693481ff91/explore","","","404 Client Error: Not Found for url: https://jlp.southandvale.gov.uk/apps/fde1c3efcad442309b35c2693481ff91/explore","Policy HOU1 – Housing requirement (Publication version, Oct 2024)

1) During the plan period, provision will be made to meet the following requirements: 

a) South Oxfordshire housing requirement: 16,530 homes between 1 April 2021 and 31 March 2041, with the 
annual requirement as follows:
i) 2021/22 to 2035/36 – 909 homes per annum 
ii) 2036/37 to 2040/41 – 579 homes per annum 

b) Vale of White Horse housing requirement: 14,490 between 1 April 2021 and 31 March 2041, with the annual 
requirement as follows: 
i) 2021/22 to 2030/31– 816 homes per annum 
ii) 2031/32 to 2040/41 – 633 homes per annum

2) This is not a joint housing requirement for South Oxfordshire and Vale of White Horse. For the purposes of determining whether a council can demonstrate a five year housing land supply, each district will measure its own supply against its own requirement.","","2020-11-05 15:18:55.745393","2025-03-21 01:32:43.524699","","2024-10-01","2024-12-09","",""
"local-authority-eng:WYO","Wycombe District Council","E07000007","Wycombe District Local Plan","8778ae29-5e6b-4fde-8245-e95b4574203a","1539","2013","2033","True","HOUSING_REQUIREMENT_TOTAL","10925","","","","True","False","https://www.wycombe.gov.uk/uploads/public/documents/Planning/Adopted-Wycombe-local-plan/Wycombe-District-Local-Plan-Adopted-August-2019.pdf","","","HTTPSConnectionPool(host='www.wycombe.gov.uk', port=443): Max retries exceeded with url: /uploads/public/documents/Planning/Adopted-Wycombe-local-plan/Wycombe-District-Local-Plan-Adopted-August-2019.pdf (Caused by NewConnectionError('<urllib3.connection.HTTPSConnection object at 0x7f8f4ef2c130>: Failed to establish a new connection: [Errno -2] Name or service not known'))","The need for housing in Wycombe District is 13,200 homes  or around 660 homes per year. However, not all this growth can be accommodated in the District.   Wycombe is proposing to build 10,925 over the plan period, or about 550 a year.   Aylesbury Vale District Council has agreed to take
our ‘unmet need’ of 2,275 dwellings","https://s3.eu-west-2.amazonaws.com/local-plans/images/8778ae29-5e6b-4fde-8245-e95b4574203a/97c53723-6c5b-463a-9d85-cfb361bbc00e.jpg","2019-04-30 14:12:38.339881","2025-03-21 01:26:09.204637","","2017-10-16","2018-03-28","2019-07-10","2019-08-19"
"local-authority-eng:BOT","Boston Borough Council","E07000136","South East Lincs Local Plan","5a9b2069-4901-4bbc-9a8f-8a784211ed03","1833","2011","2036","True","HOUSING_REQUIREMENT_TOTAL","7744","","","","True","True","http://www.southeastlincslocalplan.org/wp-content/uploads/2019/02/Local-Plan-text-March-2019.pdf","https://s3.eu-west-2.amazonaws.com/local-plans/plan-documents/5a9b2069-4901-4bbc-9a8f-8a784211ed03.pdf","80b2c6d29e3345b27fb999ab6167f16a","Document at http://www.southeastlincslocalplan.org/wp-content/uploads/2019/02/Local-Plan-text-March-2019.pdf might not be a pdf","","https://s3.eu-west-2.amazonaws.com/local-plans/images/5a9b2069-4901-4bbc-9a8f-8a784211ed03/cf4b7ea7-f6cd-4fdf-b011-39f2baf052d5.jpg","2019-04-30 14:12:40.120635","2025-03-21 01:08:17.442005","","2017-04-10","2017-06-23","2019-01-29","2019-03-08"
"local-authority-eng:BNH","Brighton and Hove City Council","E06000043","Brighton and Hove City Plan Part One","0e2b5875-0d92-4202-bff0-b717324eeb5d","1418","2010","2030","True","HOUSING_REQUIREMENT_TOTAL","13200","","","","True","False","https://www.brighton-hove.gov.uk/sites/brighton-hove.gov.uk/files/FINAL%20version%20cityplan%20March%202016compreswith%20forward_0.pdf","https://s3.eu-west-2.amazonaws.com/local-plans/plan-documents/0e2b5875-0d92-4202-bff0-b717324eeb5d.pdf","414e53ef36c2911a367b434e6127c4de","","Housing Trajectory: 2014-2019 655 DPA; 2019-2024 856 DPA; 2025-2030 712 DPA","https://s3.eu-west-2.amazonaws.com/local-plans/images/0e2b5875-0d92-4202-bff0-b717324eeb5d/cc557c91-3c05-4c10-93ae-294834375261.jpg","2019-04-30 14:12:38.490371","2025-03-21 01:18:07.649603","","2013-02-25","2013-06-27","2016-02-05","2016-03-24"
"local-authority-eng:WOI","Woking Borough Council","E07000217","Woking Borough Core Strategy","a7e6d646-54de-45b6-9085-adb7808b9f56","1073","2010","2027","True","HOUSING_REQUIREMENT_TOTAL","4964","","","","True","False","https://www.woking2027.info/developmentplan/corestrategy/adoptedcorestrategy.pdf","https://s3.eu-west-2.amazonaws.com/local-plans/plan-documents/a7e6d646-54de-45b6-9085-adb7808b9f56.pdf","1b5b2231a01424dec21de07ced4b58ee","","Woking self-reviewed in October 2018 concluding that there was no immediate need to modify the Core Strategy either in part or as a whole.  

In terms of unmet need,  Woking has an unmet need of 225 DPA. 
(i)	Guildford - the plan makes no allowance in the housing figure in Guildford’s Plan for Woking’s unmet need (see IR 24-38 in the examining Inspector’s report on Guildford’s Plan).  However this can be accommodated within the Guildford Local Plan’s “headroom”. 
(ii)	Waverley’s Plan meets 50% of Woking’s unmet need (83 DPA through the life of Waverley’s Plan). 
","https://s3.eu-west-2.amazonaws.com/local-plans/images/a7e6d646-54de-45b6-9085-adb7808b9f56/70874e59-04a9-41b1-a5ca-9f1723e2a0ca.jpg","2019-04-30 14:12:38.608062","2025-03-21 01:08:16.183882","","2011-07-25","2011-12-19","2012-07-26","2012-10-25"
