"planning_authority","name","ons_code","plan_title","plan_id","local_development_framework_number","start_year","end_year","plan_period_found","housing_number_type","number","min","max","joint_plan_total","housing_numbers_found","is_joint_plan","source_document","cached_source_document","source_document_checksum","error_caching_source_document","notes","screenshot","created_date","updated_date","last_updated_by","published","submitted","found_sound","adopted"
"local-authority-eng:LIC","City of Lincoln Council","E07000138","Central Lincolnshire Local Plan Review","037fba2c-eaf5-451a-ac49-4702ac2a61bf","2110","2018","2040","True","HOUSING_REQUIREMENT_TOTAL","","","","24244","True","True","https://www.n-kesteven.gov.uk/sites/default/files/2023-03/STA033%20Central%20Lincs%20Local%20Plan%20-%20Inspectors%20Report%20-%20FINAL.pdf","https://s3.eu-west-2.amazonaws.com/local-plans/plan-documents/037fba2c-eaf5-451a-ac49-4702ac2a61bf.pdf","772e5374f56974718370b7ffdb2c15d6","An error occurred (InvalidAccessKeyId) when calling the PutObject operation: The AWS Access Key Id you provided does not exist in our records.","No disaggregation to District level.  Numbers taken from MM1 (March 2023).  Annual average is 1,102 DPA","https://s3.eu-west-2.amazonaws.com/local-plans/images/037fba2c-eaf5-451a-ac49-4702ac2a61bf/57ef79d8-95ea-4369-8523-484d9b4bac3a.jpg","2020-10-07 15:04:36.627782","2025-03-21 01:28:48.340235","","2022-03-16","2022-07-08","2023-03-28","2023-04-13"
"local-authority-eng:OXO","Oxford City Council","E07000178","Oxford Local Plan 2036","211c51b8-45eb-422a-b364-46acfed71b84","2003","2016","2036","True","HOUSING_REQUIREMENT_TOTAL","10884","","","","True","False","https://www.oxford.gov.uk/downloads/download/1176/oxford_local_plan_2016-2036","","","Document at https://www.oxford.gov.uk/downloads/download/1176/oxford_local_plan_2016-2036 might not be a pdf","Stepped Trajectory: the housing requirement per annum reflects a stepped trajectory, as follows:
2016/17 to 2020/21: 475 dpa
2021/22 to 2035/36: 567 dpa.  

Unmet Need:
The Local Plans for the other Oxfordshire districts are delivering 14,300 dwellings to meet Oxford’s unmet need, as follows:
Cherwell Local Plan Partial Review: Oxford’s unmet
needs - 4,400 dwellings (Plan submitted March 2018; Examination Autumn 2018);
South Oxfordshire Local Plan 2033 - 4,950 dwellings (Plan yet to be submitted submitted March 2019);
Vale of White Horse Local Plan Part 2
2,200 dwellings (Examination July 2018);
West Oxfordshire Local Plan 2,750 dwellings (Adopted September 2018).
Total provision towards Oxford’s unmet needs by
2031 = 14,300 dwellings.

","https://s3.eu-west-2.amazonaws.com/local-plans/images/211c51b8-45eb-422a-b364-46acfed71b84/c156c0ab-c780-4662-bddd-ea20eb7da461.jpg","2019-04-30 14:12:39.372978","2025-03-21 01:28:41.173992","","2018-11-01","2019-03-22","2020-05-15","2020-06-08"
"local-authority-eng:OXO","Oxford City Council","E07000178","Oxford Local Plan 2040 - WITHDRAWN 27 January 2025","32f0cdb3-c486-4ab8-b4cf-5efdcaef0a43","2398","2020","2040","True","HOUSING_REQUIREMENT_TOTAL","9612","","","","True","False","https://www.oxford.gov.uk/downloads/file/8759/oxford_local_plan_2040_proposed_submission_draft","","","404 Client Error: Not Found for url: https://www.oxford.gov.uk/downloads/file/8759/oxford_local_plan_2040_proposed_submission_draft","Housing requirement figure taken from publication version of emerging plan (Nov 2023)","https://s3.eu-west-2.amazonaws.com/local-plans/images/32f0cdb3-c486-4ab8-b4cf-5efdcaef0a43/8e5eba2e-52d0-4be6-af54-0e0941160c7f.jpg","2020-11-20 13:22:45.288026","2025-03-21 01:10:43.319409","","2023-11-10","2024-03-28","",""
"local-authority-eng:LBH","London Borough of Lambeth","E09000022","Lambeth Local Plan Review","695bb2ed-e6c1-401d-a735-dc4ea2b88a70","2030","2020","2035","True","HOUSING_REQUIREMENT_TOTAL","18416","","","","True","False","https://beta.lambeth.gov.uk/sites/default/files/2021-09/Lambeth%20Local%20Plan%202021.pdf","https://s3.eu-west-2.amazonaws.com/local-plans/plan-documents/695bb2ed-e6c1-401d-a735-dc4ea2b88a70.pdf","b86e5acfb9e13f2f53d000b41a18c8fe","HTTPSConnectionPool(host='beta.lambeth.gov.uk', port=443): Max retries exceeded with url: /sites/default/files/2021-09/Lambeth%20Local%20Plan%202021.pdf (Caused by SSLError(SSLCertVerificationError(1, '[SSL: CERTIFICATE_VERIFY_FAILED] certificate verify failed: unable to get local issuer certificate (_ssl.c:997)')))","The new London Plan requires at least 13,350 additional dwellings in Lambeth
over the period 2019/20 to 2028/29, with an annual target of at least 1,335
net additional dwellings per annum (dpa). These targets are derived from
an assessment of housing sites within the borough, carried out as part of
the London-wide Strategic Housing Land Availability Assessment (SHLAA
2017). The housing trajectory for this ten year period is included in Annex 12,
along with the indicative housing requirement figures for the five designated
neighbourhood planning areas in Lambeth (or the part of those cross-border
areas that fall within Lambeth). The indicative target for years 11-15 of the plan
period is 5,066 net additional dwellings (or 1,013 dpa), based on the 2017
SHLAA findings and by rolling forward the borough’s small housing sites figure
in accordance with paragraph 4.1.12 of the London Plan. 
","https://s3.eu-west-2.amazonaws.com/local-plans/images/695bb2ed-e6c1-401d-a735-dc4ea2b88a70/7a964dca-ad1d-4268-b93a-f2a118ffb9fb.jpg","2020-02-04 17:00:07.754545","2025-03-21 01:08:16.926881","","2020-01-31","2020-05-22","2021-07-22","2021-09-22"
"local-authority-eng:NEW","New Forest District Council","E07000091","Local Plan Review 2016-2036 - Part One: Planning Strategy","f6868aaf-a9af-4447-baa0-dd735becbf48","1935","2016","2036","True","HOUSING_REQUIREMENT_TOTAL","10420","","","","True","False","https://www.newforest.gov.uk/media/705/Local-Plan-Document-2016-2036/pdf/Local_Plan_2016_2036FINAL_v2.pdf?m=637304853970400000","https://s3.eu-west-2.amazonaws.com/local-plans/plan-documents/f6868aaf-a9af-4447-baa0-dd735becbf48.pdf","6b2f7bd86aa873778ef4b17083df263c","An error occurred (InvalidAccessKeyId) when calling the PutObject operation: The AWS Access Key Id you provided does not exist in our records.","The target is to provide at least 10,420 additional homes in the Plan Area for the Plan Period 2016-2036, phased as follows:

•  Approximately 1,500 homes (averaging 300 hpa) 2016-17 to 2020-2121
•  Approximately 2,000 homes (averaging 400 hpa) 2021-22 to 2025- 26
•  Approximately 7,000 homes (averaging 700 hpa)  2026-27 to 2035- 36
","https://s3.eu-west-2.amazonaws.com/local-plans/images/f6868aaf-a9af-4447-baa0-dd735becbf48/08331c24-0f48-420a-adb6-6ae1d6a62256.jpg","2019-04-30 14:12:40.303676","2025-03-21 01:13:28.192144","","2018-06-29","2018-11-01","2020-03-25","2020-07-06"
"local-authority-eng:NKE","North Kesteven District Council","E07000139","Central Lincolnshire Local Plan Review","037fba2c-eaf5-451a-ac49-4702ac2a61bf","2110","2018","2040","True","HOUSING_REQUIREMENT_TOTAL","","","","24244","True","True","https://www.n-kesteven.gov.uk/sites/default/files/2023-03/STA033%20Central%20Lincs%20Local%20Plan%20-%20Inspectors%20Report%20-%20FINAL.pdf","https://s3.eu-west-2.amazonaws.com/local-plans/plan-documents/037fba2c-eaf5-451a-ac49-4702ac2a61bf.pdf","772e5374f56974718370b7ffdb2c15d6","An error occurred (InvalidAccessKeyId) when calling the PutObject operation: The AWS Access Key Id you provided does not exist in our records.","No disaggregation to District level.  Numbers taken from MM1 (March 2023).  Annual average is 1,102 DPA","https://s3.eu-west-2.amazonaws.com/local-plans/images/037fba2c-eaf5-451a-ac49-4702ac2a61bf/57ef79d8-95ea-4369-8523-484d9b4bac3a.jpg","2020-10-07 15:04:36.627782","2025-03-21 01:28:48.340235","","2022-03-16","2022-07-08","2023-03-28","2023-04-13"
"local-authority-eng:NED","North East Derbyshire District Council","E07000038","North East Derbyshire Local Plan (2014 - 2034)","269fe47a-004f-4a5e-8ac6-bb37482c33f2","1905","2014","2034","True","HOUSING_REQUIREMENT_TOTAL","6600","","","","True","False","https://www.ne-derbyshire.gov.uk/component/edocman/adopted-ned-local-plan-2014-2034/download?Itemid=0","https://s3.eu-west-2.amazonaws.com/local-plans/plan-documents/269fe47a-004f-4a5e-8ac6-bb37482c33f2.pdf","e12a444788ae4b6e6a63a0fc9494f73c","403 Client Error: Forbidden for url: https://www.ne-derbyshire.gov.uk/component/edocman/adopted-ned-local-plan-2014-2034/download?Itemid=0","","https://s3.eu-west-2.amazonaws.com/local-plans/images/269fe47a-004f-4a5e-8ac6-bb37482c33f2/a8ddfb61-5f09-4a03-bf75-251dbbf05755.jpg","2019-04-30 14:12:40.437617","2025-03-21 01:10:51.641271","","2018-02-21","2018-05-24","2021-07-19","2021-11-29"
"local-authority-eng:MIK","Milton Keynes Council","E06000042","Plan:MK","18a7a012-9dd1-4f9c-ae0b-7f6537e4790f","1874","2016","2031","True","HOUSING_REQUIREMENT_TOTAL","26500","","","","True","False","https://www.milton-keynes.gov.uk/assets/attach/59310/PlanMK%20Adoption%20Version%20(March%202019).pdf","https://s3.eu-west-2.amazonaws.com/local-plans/plan-documents/18a7a012-9dd1-4f9c-ae0b-7f6537e4790f.pdf","64ae00f2b65cc2b541182ad7e82db4ee","404 Client Error: Not Found for url: https://www.milton-keynes.gov.uk/assets/attach/59310/PlanMK%20Adoption%20Version%20(March%202019).pdf","","https://s3.eu-west-2.amazonaws.com/local-plans/images/18a7a012-9dd1-4f9c-ae0b-7f6537e4790f/b98e816a-ff52-4792-944c-4cc6e18b5a7e.jpg","2019-04-30 14:12:40.297504","2025-03-21 01:29:15.150476","","2017-11-08","2018-03-29","2019-02-12","2019-03-20"
"local-authority-eng:STY","South Tyneside Council","E08000023","South Tyneside LDF: Core Strategy","a9c0dfea-a696-4c82-9931-f6a5b7f8b106","300","2004","2021","True","HOUSING_REQUIREMENT_YEARLY_AVERAGE","325","","","","True","False","https://www.southtyneside.gov.uk/media/2468/Core-Strategy-Adopted-June-2007-/pdf/Core_Strategy_(Final_Adopted_Version_-_cWHS_modified_2014).pdf","https://s3.eu-west-2.amazonaws.com/local-plans/plan-documents/a9c0dfea-a696-4c82-9931-f6a5b7f8b106.pdf","d6b08b131d2083ffef463608c45d7d93","An error occurred (InvalidAccessKeyId) when calling the PutObject operation: The AWS Access Key Id you provided does not exist in our records.","","https://s3.eu-west-2.amazonaws.com/local-plans/images/a9c0dfea-a696-4c82-9931-f6a5b7f8b106/1de6d2e1-03a8-47ee-ac5a-6b164a1fc6d0.jpg","2019-04-30 14:12:38.530523","2025-03-21 01:30:05.955694","","2006-03-24","2006-03-24","2007-04-25","2007-06-28"
"local-authority-eng:STY","South Tyneside Council","E08000023","The South Tyneside Local Plan","d012eae9-8efb-454c-a286-1bfb1d21ace9","2232","2023","2040","True","HOUSING_REQUIREMENT_TOTAL","5253","","","","True","False","https://www.southtyneside.gov.uk/media/6874/Publication-Draft-Local-Plan-2023-2040/pdf/Publication_Draft_Local_Plan_2023_to_2040.pdf?m=638403079278570000","https://s3.eu-west-2.amazonaws.com/local-plans/plan-documents/d012eae9-8efb-454c-a286-1bfb1d21ace9.pdf","64db662e5db9866b5565af7e55a1a37e","","","https://s3.eu-west-2.amazonaws.com/local-plans/images/d012eae9-8efb-454c-a286-1bfb1d21ace9/ccef9990-a5c5-474c-8f84-9e403f4c5755.jpg","2020-09-16 14:59:26.444918","2025-03-21 01:13:27.206265","","2024-01-15","","",""
"local-authority-eng:STE","Stoke-on-Trent City Council","E06000021","Newcastle-under-Lyme and Stoke-on-Trent Core Spatial Strategy 2006-2026","54ee799a-3874-4a32-82ee-c5632b7c4b69","550","2006","2026","True","HOUSING_REQUIREMENT_TOTAL","11400","","","","True","True","https://www.newcastle-staffs.gov.uk/sites/default/files/IMCE/Planning/Planning_Policy/SpatialStrategy/Core%20Strategy%20Final%20Version%20-%2028th%20October.pdf","https://s3.eu-west-2.amazonaws.com/local-plans/plan-documents/54ee799a-3874-4a32-82ee-c5632b7c4b69.pdf","54a01845d810da30b4a43f41a39ece1a","404 Client Error: Not Found for url: https://www.newcastle-staffs.gov.uk/sites/default/files/IMCE/Planning/Planning_Policy/SpatialStrategy/Core%20Strategy%20Final%20Version%20-%2028th%20October.pdf","","https://s3.eu-west-2.amazonaws.com/local-plans/images/54ee799a-3874-4a32-82ee-c5632b7c4b69/18e3dcc3-ed54-41f8-a8e6-86b05055c1b0.jpg","2019-04-30 14:12:39.583304","2025-03-21 01:23:40.719658","","2008-08-29","2008-12-22","2009-06-23","2009-10-01"
"local-authority-eng:STE","Stoke-on-Trent City Council","E06000021","Stoke-on-Trent Local Plan 2020-2040","72b36302-8466-43d7-94ba-860bad3da60b","2136","2020","2040","True","HOUSING_REQUIREMENT_YEARLY_AVERAGE","684","","","","True","False","https://secureapps.stoke.gov.uk/ConsultationPortal/ConsultationPortal/ComposeDocument.aspx","","","Document at https://secureapps.stoke.gov.uk/ConsultationPortal/ConsultationPortal/ComposeDocument.aspx might not be a pdf","There are four options for housing requirement at this early stage: A1 10,140 (507 DPA); A2 13,680 (684 DPA); B 16,220 (811 DPA); C 21,480 (1,074 DPA). Source: Issues and Options consultation document May 2021.","https://s3.eu-west-2.amazonaws.com/local-plans/images/72b36302-8466-43d7-94ba-860bad3da60b/656a0b15-2fd2-40d5-8a9f-ddfc24a57e2d.jpg","2021-06-07 13:26:26.467284","2025-03-21 01:26:14.005625","","","","",""
"local-authority-eng:TON","Tonbridge and Malling Borough Council","E07000115","Core Strategy","df7a6d48-c8b9-4d57-87d8-04c9592b31a3","264","2006","2021","True","HOUSING_REQUIREMENT_TOTAL","6375","","","","True","False","https://www.tmbc.gov.uk/__data/assets/pdf_file/0020/13808/Core_Strategy.pdf","https://s3.eu-west-2.amazonaws.com/local-plans/plan-documents/df7a6d48-c8b9-4d57-87d8-04c9592b31a3.pdf","2a56a203aa2c9f872e32e9938dd4a1d0","404 Client Error: Not Found for url: https://www.tmbc.gov.uk/__data/assets/pdf_file/0020/13808/Core_Strategy.pdf","","https://s3.eu-west-2.amazonaws.com/local-plans/images/df7a6d48-c8b9-4d57-87d8-04c9592b31a3/fe687416-658b-40a5-9834-36eeb853cc9c.jpg","2019-04-30 14:12:38.503428","2025-03-21 01:10:55.451529","","2006-08-31","2006-08-31","2007-08-15","2007-09-25"
"local-authority-eng:TON","Tonbridge and Malling Borough Council","E07000115","Tonbridge & Malling Borough Local Plan (WITHDRAWN 13 JULY 2021)","b393fec5-4ddb-4368-8a57-c35ee04956a4","1469","2011","2031","True","HOUSING_REQUIREMENT_TOTAL","6834","","","","True","False","https://www.tmbc.gov.uk/__data/assets/pdf_file/0005/618890/Local_Plan_Submission_January_2019.pdf","","","404 Client Error: Not Found for url: https://www.tmbc.gov.uk/__data/assets/pdf_file/0005/618890/Local_Plan_Submission_January_2019.pdf","IR (7 June 2021) found the plan is not legally compliant in respect of the Duty to Cooperate (DtC) and, as such, we
recommend that the Plan is not adopted.  The Plan was subsequently withdrawn on 21 July 2021.","https://s3.eu-west-2.amazonaws.com/local-plans/images/b393fec5-4ddb-4368-8a57-c35ee04956a4/ebc0ecc0-572b-43e2-a5df-849166d75b2e.jpg","2019-04-30 14:12:39.458844","2025-03-21 01:30:12.797386","","2018-10-05","2019-01-23","",""
"local-authority-eng:TON","Tonbridge and Malling Borough Council","E07000115","Tonbridge and Malling Local Plan 2025-2040","62a7b4cf-b276-43f3-9aa8-53daa1e56e66","2287","2021","2040","True","HOUSING_REQUIREMENT_YEARLY_AVERAGE","839","","","","True","False","https://www.tmbc.gov.uk/downloads/file/2216/regulation-18-local-plan-2022","","","404 Client Error: Not Found for url: https://www.tmbc.gov.uk/downloads/file/2216/regulation-18-local-plan-2022","Housing numbers taken from Reg 18 draft plan (September 2022).  Based upon the standard method, the housing need for Tonbridge & Malling is 839 DPA  (2021). This translates to a gross need across the plan period of 15,941 dwellings or 9,245 net across the period 2021-2040.  The council considers that the only reasonable approach to take is to meet the assessed need for housing in full, as directed by the NPPF.  Numbers subject to change!","https://s3.eu-west-2.amazonaws.com/local-plans/images/62a7b4cf-b276-43f3-9aa8-53daa1e56e66/76bc8531-d4f8-4526-b8be-dde5128aaf04.jpg","2022-09-22 10:32:11.385495","2025-03-21 01:28:48.927116","","","","",""
"local-authority-eng:STT","Stockton-on-Tees Borough Council","E06000004","Stockton-on-Tees Borough Council: Local Plan","b35b2ea5-ea2c-419d-958a-286ff6f3cd41","1856","2017","2032","True","HOUSING_REQUIREMENT_TOTAL","10150","","","","True","False","https://www.stockton.gov.uk/media/1585775/localplanmainreportcontents.pdf","https://s3.eu-west-2.amazonaws.com/local-plans/plan-documents/b35b2ea5-ea2c-419d-958a-286ff6f3cd41.pdf","7775eed052849f1753907c524e09573a","404 Client Error: Not Found for url: https://www.stockton.gov.uk/media/1585775/localplanmainreportcontents.pdf","","https://s3.eu-west-2.amazonaws.com/local-plans/images/b35b2ea5-ea2c-419d-958a-286ff6f3cd41/da5be5b0-1274-4ac5-b4c0-aa2bee292d62.jpg","2019-04-30 14:12:39.215638","2025-03-21 01:18:09.268253","","2017-09-25","2017-12-21","2018-12-17","2019-01-30"
"local-authority-eng:SWD","Swindon Borough Council","E06000030","Swindon Borough Local Plan 2026","60e20958-1eba-4aca-bed4-dca99d89ca8d","1386","2011","2026","True","HOUSING_REQUIREMENT_TOTAL","22000","","","","True","False","https://www.swindon.gov.uk/download/downloads/id/3988/swindon_borough_local_plan_2026.pdf","https://s3.eu-west-2.amazonaws.com/local-plans/plan-documents/60e20958-1eba-4aca-bed4-dca99d89ca8d.pdf","2f0b1194abf0581895a38c7e6fddd6f9","","Stepped requirement: 2011-2016: 1150 DPA; 2016-2026: 1625 DPA","https://s3.eu-west-2.amazonaws.com/local-plans/images/60e20958-1eba-4aca-bed4-dca99d89ca8d/98f63d82-02a8-4530-85a2-3ae60118efe1.jpg","2019-04-30 14:12:38.830829","2025-03-21 01:29:39.262452","","2012-12-20","2013-06-28","2015-02-05","2015-03-26"
"local-authority-eng:SWK","London Borough of Southwark","E09000028","Southwark Plan 2022","2e3ad928-7219-42c1-aab7-899c1569af05","1883","2019","2036","True","HOUSING_REQUIREMENT_TOTAL","40035","","","","True","False","https://www.southwark.gov.uk/assets/attach/94325/Southwark-Plan-2022.pdf","https://s3.eu-west-2.amazonaws.com/local-plans/plan-documents/2e3ad928-7219-42c1-aab7-899c1569af05.pdf","0d9c239750a40fae913dca11599a75b6","404 Client Error: Not Found for url: https://www.southwark.gov.uk/assets/attach/94325/Southwark-Plan-2022.pdf","","https://s3.eu-west-2.amazonaws.com/local-plans/images/2e3ad928-7219-42c1-aab7-899c1569af05/a1918e98-57ec-4772-8da6-92128d912c6c.jpg","2019-04-30 14:12:40.938159","2025-03-21 01:28:44.888861","","2018-01-02","2020-01-16","2021-11-17","2022-02-23"
"local-authority-eng:STV","Stevenage Borough Council","E07000243","Stevenage Borough Local Plan","93a3b417-4093-4b7b-beff-14bd0a000eb5","844","2011","2031","True","HOUSING_REQUIREMENT_TOTAL","7600","","","","True","False","http://www.stevenage.gov.uk/content/15953/26379/161749/165485/1710-SBLP-Adoption-Version.pdf","https://s3.eu-west-2.amazonaws.com/local-plans/plan-documents/93a3b417-4093-4b7b-beff-14bd0a000eb5.pdf","c3e5134e02ab4ac966e9108f6719f556","404 Client Error: Not Found for url: https://www.stevenage.gov.uk/content/15953/26379/161749/165485/1710-SBLP-Adoption-Version.pdf","","https://s3.eu-west-2.amazonaws.com/local-plans/images/93a3b417-4093-4b7b-beff-14bd0a000eb5/44094ddc-8827-437e-b4da-1ca2ffef94ff.jpg","2019-04-30 14:12:39.196653","2025-03-21 01:21:15.616615","","2016-01-06","2016-07-22","2017-10-18","2019-05-22"
"local-authority-eng:TAN","Tandridge District Council","E07000215","Tandridge District Core Strategy","6617edd1-f845-417c-9f11-cb50ba744750","812","2006","2026","True","HOUSING_REQUIREMENT_TOTAL","2500","","","","True","False","https://www.tandridge.gov.uk/Portals/0/Documents/Planning%20and%20building/Planning%20strategies%20and%20policies/Current%20and%20adopted%20planning%20policies/Core%20strategy/Core-Strategy.pdf","https://s3.eu-west-2.amazonaws.com/local-plans/plan-documents/6617edd1-f845-417c-9f11-cb50ba744750.pdf","c6e348139fc16be63c4997a625a256e5","HTTPSConnectionPool(host='www.tandridge.gov.uk', port=443): Max retries exceeded with url: /Portals/0/Documents/Planning%20and%20building/Planning%20strategies%20and%20policies/Current%20and%20adopted%20planning%20policies/Core%20strategy/Core-Strategy.pdf (Caused by NewConnectionError('<urllib3.connection.VerifiedHTTPSConnection object at 0x7ffbb2a57da0>: Failed to establish a new connection: [Errno 110] Connection timed out'))","","https://s3.eu-west-2.amazonaws.com/local-plans/images/6617edd1-f845-417c-9f11-cb50ba744750/27c2c314-f4e6-4add-8d3f-d355119e87d6.jpg","2019-04-30 14:12:39.706140","2025-03-21 01:10:56.735967","","2007-12-28","2008-01-17","2008-09-15","2008-10-15"
"local-authority-eng:TAN","Tandridge District Council","E07000215","Our Local Plan 2033 [found unsound 14 February 2024]","716c27fa-4e56-4fbc-8a1d-f86fe99a2b7e","1933","2013","2033","True","HOUSING_REQUIREMENT_TOTAL","6056","","","","True","False","https://www.tandridge.gov.uk/Portals/0/Documents/Planning%20and%20building/Planning%20strategies%20and%20policies/Local%20plan/Local%20plan%202033/Examination%20library/MAIN%20DOCUMENTS/MD1-Our-Local-Plan-2033-Submission-2019.pdf","https://s3.eu-west-2.amazonaws.com/local-plans/plan-documents/716c27fa-4e56-4fbc-8a1d-f86fe99a2b7e.pdf","2224e72dff9aa4eac5fa2ac88789af78","HTTPSConnectionPool(host='www.tandridge.gov.uk', port=443): Max retries exceeded with url: /Portals/0/Documents/Planning%20and%20building/Planning%20strategies%20and%20policies/Local%20plan/Local%20plan%202033/Examination%20library/MAIN%20DOCUMENTS/MD1-Our-Local-Plan-2033-Submission-2019.pdf (Caused by SSLError(SSLCertVerificationError(1, '[SSL: CERTIFICATE_VERIFY_FAILED] certificate verify failed: certificate has expired (_ssl.c:1056)')))","","https://s3.eu-west-2.amazonaws.com/local-plans/images/716c27fa-4e56-4fbc-8a1d-f86fe99a2b7e/a4c228af-6b89-469b-bb26-6d59660c19a5.jpg","2019-04-30 14:12:39.724023","2025-03-21 01:11:14.689528","","2018-07-30","2019-01-18","",""
"local-authority-eng:TAU","Taunton Deane Borough Council","E07000190","Taunton Deane Adopted Core Strategy","5627dd48-f80d-43ca-9357-49390aee0e02","1256","2008","2028","True","HOUSING_REQUIREMENT_TOTAL","17000","","","","True","False","https://www.somersetwestandtaunton.gov.uk/media/1061/adopted-core-strategy-2011-2028.pdf","https://s3.eu-west-2.amazonaws.com/local-plans/plan-documents/5627dd48-f80d-43ca-9357-49390aee0e02.pdf","978ac00777a4e6b7e8291913c50f33f8","404 Client Error: Not Found for url: https://www.somerset.gov.uk/we-have-moved/","","https://s3.eu-west-2.amazonaws.com/local-plans/images/5627dd48-f80d-43ca-9357-49390aee0e02/2d104e0f-4f60-4326-94be-ca1d7f7833c2.jpg","2019-04-30 14:12:38.895240","2025-03-21 01:11:14.885860","","2011-07-15","2011-11-14","2012-07-03","2012-09-11"
"local-authority-eng:SWL","Swale Borough Council","E07000113","Bearing Fruits 2031: The Swale Local Plan","22dd9906-59fd-421b-aee8-c45d2e40868b","1636","2014","2031","True","HOUSING_REQUIREMENT_TOTAL","13192","","","","True","False","http://services.swale.gov.uk/media/files/localplan/adoptedlocalplanfinalwebversion.pdf","https://s3.eu-west-2.amazonaws.com/local-plans/plan-documents/22dd9906-59fd-421b-aee8-c45d2e40868b.pdf","5472cf66a13f73da204019b9c18ac77e","404 Client Error: Not Found for url: http://services.swale.gov.uk/media/files/localplan/adoptedlocalplanfinalwebversion.pdf","","https://s3.eu-west-2.amazonaws.com/local-plans/images/22dd9906-59fd-421b-aee8-c45d2e40868b/820a96f5-b3aa-4c77-8ae2-c7a5d12607bb.jpg","2019-04-30 14:12:38.377928","2025-03-21 01:32:39.927141","","2014-12-19","2015-04-20","2017-06-20","2017-07-26"
"local-authority-eng:SWL","Swale Borough Council","E07000113","Local Plan Review","37c09e6b-8a19-4926-b82c-082c65236689","2257","2022","2040","True","HOUSING_REQUIREMENT_TOTAL","16608","","","","True","False","https://services.swale.gov.uk/assets/Planning%20Policy%202019/FINAL%20Reg%2019%20(RGB)%20119MB.pdf","","","An error occurred (InvalidAccessKeyId) when calling the PutObject operation: The AWS Access Key Id you provided does not exist in our records.","To consult again at Reg 18 stage this autumn and then publish Jan-March 2025","https://s3.eu-west-2.amazonaws.com/local-plans/images/37c09e6b-8a19-4926-b82c-082c65236689/62d6ab68-9f34-4e2c-a438-d3470e7278ab.jpg","2019-04-30 14:12:38.405329","2025-03-21 01:28:40.860633","","2021-02-08","","",""
"local-authority-eng:SGC","South Gloucestershire Council","E06000025","Core Strategy","8c07a862-73a3-4437-bb83-e3ecdd898bec","1133","2006","2027","True","HOUSING_REQUIREMENT_TOTAL","28355","","","","True","False","http://www.southglos.gov.uk/documents/cleanversionforinterimpublication2.pdf","https://s3.eu-west-2.amazonaws.com/local-plans/plan-documents/8c07a862-73a3-4437-bb83-e3ecdd898bec.pdf","f149e2bb1bf00a972238eb11eb06d132","HTTPConnectionPool(host='www.southglos.gov.uk', port=80): Max retries exceeded with url: /documents/cleanversionforinterimpublication2.pdf (Caused by NewConnectionError('<urllib3.connection.HTTPConnection object at 0x7fccaf54f630>: Failed to establish a new connection: [Errno -3] Temporary failure in name resolution'))","","https://s3.eu-west-2.amazonaws.com/local-plans/images/1f4b74e4-38bf-46fc-8b69-ff4087dabbe8.jpg","2019-04-30 14:12:41.044414","2025-03-21 01:18:28.767765","","2010-06-01","2011-03-31","2013-11-15","2013-12-11"
